qid,docno,text,rank
148538,i_r_c_148538,"The difference between an RN and a BSN is that an RN is a title for a registered nurse, while a BSN stands for a Bachelor of Science in nursing. A BSN RN is just an RN with a bachelor's degree--basically, they have the most schooling and it (usually) takes the longest to achieve. • Categorized under Science | Difference Between Rn and Bsn RN vs BSN RN is a Registered Nurse, and is a health care specialist who uses her learned nursing practices and processes to take care of an ailing person. A BSN is a Bachelor of Science in Nursing, while an ADN is an Associates Degree in Nursing. RN stands for registered nurse BSN for Bachelor of science in nursing. A BSN is a Bachelor of Science in Nursing, while an ADN is an Associates Degree in Nursing. Basically the difference is BSN is a bachelors degree. Difference Between Rn and Bsn. With that said the actual difference between an RN (ADN) and an RN (BSN) might be better measured in the way of professional opportunity and options for upward mobility rather than the actual pay for a position. The difference with ASN and BSN is ASN is a 2 year degree and BSN is a 4 year degree. Both allow you to work as a registered nurse, but what is the benefit and difference of getting a BSN versus RN. BSN, bachelor of science nursing, and ADN, associate degree nursing are two of the educational levels that allow one to test for an RN license.Don't mix up the license with the education level required to get the license.SN is a four-year degree, aka Bachelor of Science Nursing. 2014 data shows that an RN earns a median of $39,100, while a BSN holder earns $69,000:ducation Requirements. For that reason, while there is no significant difference in the salary of an ADN RN and a BSN RN working as a staff nurse on a hospital unit, a nurse with a BSN will make more income over the course of their career.Many ADN graduates return to school and complete their BSN after they start working.owever, many facilities also offer a differential for the BSN degree. What is the difference between a BSN and an RN. What is the difference between a BSN and an RN. ",0
451602,i_r_c_451602,"Mechanical ventilation may be defined as the use of a mechanical device to provide. ventilator support for patients. Mechanical ventilation is the medical term for artificial ventilation where mechanical means is used to assist or replace spontaneous breathing. Mechanical ventilation is the medical term for artificial ventilation where mechanical means is used to assist or replace spontaneous breathing. Mechanical ventilation: Use of a machine called a ventilator or respirator to improve the exchange of air between the lungs and the atmosphere. A medical ventilator (or simply ventilator in context) is a machine designed to mechanically move breathable air into and out of the lungs, to provide the mechanism of breathing for a patient who is physically unable to breathe, or breathing insufficiently. Mechanical ventilation, in the healthcare setting or home, helps patients breathe by assisting the inhalation of oxygen into the lungs and the exhalation of carbon dioxide.Depending on the patient’s condition, mechanical ventilation can help support or completely control breathing.oncerns how much inspiratory or “trigger” effort is required from the ventilator to recognize that the patient is trying to inhale; this can refer to a ventilator setting, but can also be used to describe the ventilator’s responsiveness to the patient’s breathing effort. Medicare claims data from 2010 indicates approximately 3,172 patients on home mechanical ventilation using an invasive interface, and 899 patients on home mechanical ventilation with a noninvasive interface.n some countries, if the patient requires ventilator support more than X hours per day, he is placed on a life-support ventilator. ",0
359349,i_r_c_359349,"In the trapezoid below, the midpoints of the non-parallel sides are points S and V. The midsegment is the red line segment from S to V. The midsegment below can be found by. calculating the lengths of the bases 35-16 = 9 (length of upper base) 45-0 =45 (length of lower base) calculating the sum of the bases 9+45 = 54. In the trapezoid below, the midpoints of the non-parallel sides are points S and V. The midsegment is the red line segment from S to V. The midsegment below can be found by. calculating the lengths of the bases 35-16 = 9 (length of upper base) 45-0 =45 (length of lower base) calculating the sum of the bases 9+45 = 54. According to this theorem mid segment of a trapezoid is equal to half of sum of its two parallel sides. The midsegment (also called the median or midline) of a trapezoid is the segment that joins the midpoints of the legs. The midsegment (also called the median or midline) of a trapezoid is the segment that joins the midpoints of the legs. The midsegment of a trapezoid is the segment that joins the midpoints of the nonparallel sides of a trapezoid. The midsegment of a trapezoid is the segment that joins the midpoints of the nonparallel sides of a trapezoid. The midsegment of a trapezoid is the segment that joins the midpoints of the nonparallel sides of a trapezoid. The midsegment (also called the median or midline) of a trapezoid is the segment that joins the midpoints of the legs. The midsegment of a trapezoid is the segment formed by connecting the midpoints of the two legs of a trapezoid. ",0
1115776,i_r_c_1115776,"AML Analysts are responsible for detecting and monitoring suspicious transactions in an effort to prevent money laundering. The BSA / AML Analyst is responsible for monitoring and investigating customer transactions under applicable anti-money laundering and anti-terrorist financing laws. The BSA/AML Analyst II is responsible for assisting with anti-money laundering and compliance initiatives. A typical AML Analyst resume usually describes duties such as implementing anti money laundering procedures, assessing daily financial activity, and preparing regular reports to AML Compliance Officers. JOB SUMMARY A Senior BSA/AML Analyst is responsible for maintaining certain aspects of the Bank's BSA/AML compliance program and assists in meeting and maintaining BSA/AML compliance requirements of the Bank. ",0
1112341,i_r_c_1112341,"The following concepts are part of Thai everyday life: ใจเย็น or JAI YEN is more a way of life, it is to keep your temper whatever the situation. T he following concepts are part of Thai everyday life: ใจเย็น or JAI YEN is more a way of life, it is to keep your temper whatever the situation. Everyday life or Daily life or Routine life is a phrase used to refer to the ways in which people typically act, think, and feel on a daily basis. The Thai people or Thais (Thai: ไทยสยาม), formerly known also as Siamese, are a nation and Tai ethnic group native to Southeast Asia, primarily Thailand. Everyday life, daily life or routine life comprises the ways in which people typically act, think, and feel on a daily basis. T hai people are educated in the family and in school to keep frustration inside. There is other types of people in Thailand like Chinese, Indian, English, Jamaican. A big part of Thai tradition is having fun and doing so in the middle of roasting hot weather is no exception. Thai people love to have fun together. Thai people love to have fun together. Everyday life may be described as considered mundane, routine, natural or habitual. Everyday life may be described as mundane, routine, natural, habitual, or normal. Instead of showing their anger toward a problem or situation, Thai people show JAI YEN, i.e. calm or patience. ",0
131843,i_r_c_131843,"SIGMETs. also. sigmets. : a notice of significant hazardous weather conditions (such as extreme turbulence, icing, or poor visibility) in a large area that is provided to the pilot of an aircraft before takeoff — compare airmet. SIGMET, or Significant Meteorological Information, is a weather advisory that contains meteorological information concerning the safety of all aircraft. SIGMET, or Significant Meteorological Information, is a weather advisory that contains meteorological information concerning the safety of all aircraft. sigmet SIGMET, or Significant Meteorological Information, is a weather advisory that contains meteorological information concerning the safety of all aircraft. SIGMET, or Significant Meteorological Information, is a weather advisory that contains meteorological information concerning the safety of all aircraft. Definition of SIGMET. plural. ",0
104861,i_r_c_104861,"The cost of a concrete floor is economical, about $2 to $6 per square foot depending on the level of complexity. Depending on the level of complexity, concrete floors can cost as little as $2 to $6 a square foot or be as expensive as $15 to $30 a square foot.ven flooring options that are initially cheaper to install than decorative concrete may turn out to be more expensive in the long run. Depending on the level of complexity, concrete floors can cost as little as $2 to $6 a square foot or be as expensive as $15 to $30 a square foot. Depending on the level of complexity, concrete floors can cost as little as $2 to $6 a square foot or be as expensive as $15 to $30 a square foot.ideo on the cost of concrete floors. Integral colored concrete floor cost: $3.75 dollars per square foot, that includes the basic concrete floor package and adding color to the concrete. 10 styrofoam used a lot for radiant heat floors those are the basics of what s included and not included in my concrete floor costs for residential concrete floors my $ 2 50 $ 3 00 dollars per sq ft cost will remain consistent throughout the yearfor commercial concrete floors the cost is anywhere from $ 50 $ 1 00 dollar per sq ft moreif you re trying to figure what the cost for concrete flooring is in your area i would suggest calling a local redi mix concrete company and asking them for 3 referrals they know who does quality work and who doesn te also do a lot of other decorative concrete applications you ll be able to find pricing for stamped concrete stained concrete and more at the bottom of the page my basic cost to pour and finish a concrete floor is $ 2 50 $ 3 00 per square foot Bamboo flooring can cost the consumer between $4 and $6 per square foot.Concrete flooring costs $2 to $15 per square foot, according to Concrete Floors.Basic, single-colored concrete flooring typically costs between $2 and $6 per square foot, while mid-grade concrete with decorative effects can cost between $6 and $8 per square foot.dditional Costs. 2 Interior jobs are slightly more since more work will be required in order to lay concrete in the home.ow much do stained concrete floors cost? 1 For those that want to get acid stained concrete work done outside, a simple stained concrete job can vary anywhere from $2 to $5 per square foot. Because the cost of a cubic yard of concrete has topped $100.00 dollars per yard in a lot of areas around the U.S., it's helpful to know the exact cost in your area.ay's Concrete Floors, Inc is the name of my company. That's $11,040.00 just for the concrete! That's $11,040.00 just for the concrete! In newly constructed homes, concrete floors are about half the price of hardwood floors.Other factors that affect the final cost of your concrete floor project include:oncrete floors can be finished off in the sheen of your choice: high gloss or low gloss. ",0
833860,i_r_c_833860,"Historically, Switzerland was a farming country, and the most popular crops and foods include cheese and potatoes as well as chocolate. Italian cuisine is popular in contemporary Switzerland, particularly pasta and pizza. Italian cuisine is popular in contemporary Switzerland, particularly pasta and pizza. Historically, Switzerland was a farming country, and the most popular crops and foods include cheese and potatoes as well as chocolate.he food in Europe can be characterized by four categories: meats, sugar, cereals, and fats. 1 Pastetli-This is a popular food in Switzerland. Italian food is very common in modern Switzerland including pasta and pizza. Italian food is very common in modern Switzerland including pasta and pizza. Italian food is very common in modern Switzerland including pasta and pizza. Italian food is very common in modern Switzerland including pasta and pizza. Italian food is very common in modern Switzerland including pasta and pizza. Italian food is very common in modern Switzerland including pasta and pizza. Foods often associated with Switzerland include cheese and chocolate. Cheese is another food for which Switzerland is known, especially since Switzerland has been producing cheese for many centuries. Foods often associated with Switzerland include cheese and chocolate. 3 Pot-Fondue this is a Famous swiss food made of melted. 3 Pot-Fondue this is a Famous swiss food made of melted. 5 Cheese-Rosti this is a common swiss dish made from grated potatoes that are raw or. cookedood of Switzerland. 5 Cheese-Rosti this is a common swiss dish made from grated potatoes that are raw or. cookedood of Switzerland. 3 Pot-Fondue this is a Famous swiss food made of melted. ",0
207786,i_r_c_207786,"Gruber: Mackerel sharks, including great whites, makos, threshers, and porbeagles, have a heat-conserving mechanism known as the rete mirabile (wonderful net), a structure for warming blood passing over the gills. Actually the Salmon Shark is a warm blooded shark. Actually the Salmon Shark is a warm blooded shark. One striking feature of these warm-bodied sharks is that their flanks and viscera are warm, while the heart and gills are at environmental temperatures. Some, like the Mako and the Great white shark, are partially warmblooded (they are endotherms). Great white sharks are some of the only warm blooded sharks. These sharks can raise their temperature about th…e temperature of the water; they need to have occasional short bursts of speed in hunting Cold blooded although if you've ever seen a Great White Shark hunt sea lions you'd be thinking they would have to be hotblooded. It depends on the type of shark, most sharks like living in warm or tropical waters,such as Hawaii and Australia.Some sharks though can live in colder waters,such as the Greenland shark and the Great White shark.The Great White Shark has even been seen in the cold waters of Sanfransisco. Shortfin Mako (Isurus oxyrinchus) A question came across SHARK-L concerning makos being considered warm-blooded and various replies touch upon aspects of the topic. Are sharks cold-blooded or warm-blooded? More on Warm-Bodied Sharks. ",0
1114819,i_r_c_1114819,"Durable Medical Equipment (DME) consists of items which: 1 are primarily and customarily used to serve a medical purpose; 2 are not useful to a person in the absence of illness, disability, or injury; 3 are ordered or prescribed by a physician; 4 are reusable; 5 can stand repeated use, and. Durable Medical Equipment (DME) consists of items which: 1 are primarily and customarily used to serve a medical purpose; 2 are not useful to a person in the absence of illness or injury; 3 are ordered or prescribed by a physician; 4 are reusable; 5 can stand repeated use, and. Durable Medical Equipment (DME) consists of items which: 1 are primarily and customarily used to serve a medical purpose; 2 are not useful to a person in the absence of illness, disability, or injury; 3 are ordered or prescribed by a physician; are 1 reusable; can stand repeated use, 2 and. are appropriate for use in the home. Durable Medical Equipment (DME) consists of items which: are primarily and customarily used to serve a medical purpose; are not useful to a person in the absence of illness, disability, or injury; are ordered or prescribed by a physician; are reusable; can stand repeated use, and are appropriate for use in the home. Durable Medical Equipment (DME) consists of items which: are primarily and customarily used to serve a medical purpose; The standard definition of Durable Medical Equipment used by insurance companies is:Durable Medical Equipment (DME) is any equipment that provides therapeutic benefits to a patient in need because of certain medical conditions and/or illnesses.Durable Medical Equipment (DME) consists of items which:1 are primarily and customarily used to serve a medical purpose; 2 are not useful to a person in the absence of illness or injury; 3 are ordered or prescribed by a physician; 4 are reusable; 5 can stand repeated use, and. Durable Medical Equipment (DME) consists of items which: ",0
183378,i_r_c_183378,"Definition of exon. : a polynucleotide sequence in a nucleic acid that codes information for protein synthesis and that is copied and spliced together with other such sequences to form messenger RNA — compare intron. Medical Definition of exon. : a polynucleotide sequence in a nucleic acid that codes information for protein synthesis and that is copied and spliced together with other such sequences to form messenger RNA—compare intron. An exon is any part of a gene that codes for a part of the final mature RNA product of that gene after introns have been removed by RNA splicing. Exon (disambiguation). may refer to: Exon, a region of DNA that is represented in the mature form of RNA | Exoniensis or Exon., the Post-Nominal Letters for alumni / degrees from the University of Exeter | Exon can also refer to the signature of the Bishop of Exeter | J... en​.wikipedia​.org​/wiki​/Exon (disambiguation). Exons are the nucleotide sequences of genes that are expressed, and those are found at either sides of an intron. Exons are small sequences of genetic code which, via an intermediate step involving RNA, lead to the assembly of sections... By definition, exons and introns are sequences in a protein-coding gene region of a double-stranded DNA molecule (dsDNA) that are expressed as proteins, or intervening sequences not so expressed. The term exon refers to both the DNA sequence within a gene and to the corresponding sequence in RNA transcripts.In RNA splicing, introns are removed and exons are covalently joined to one another as part of generating the mature messenger RNA.he term exon refers to both the DNA sequence within a gene and to the corresponding sequence in RNA transcripts. ",0
1106007,i_r_c_1106007,"Definition of 'visceral'. visceral (vɪsərəl ) Visceral feelings are feelings that you feel very deeply and find it difficult to control or ignore, and that are not the result of thought. visceral ‎(comparative more visceral, superlative most visceral) ( 1 anatomy) Of or relating to the viscera—internal organs of the body; splanchnic. Define visceral: felt in or as if in the internal organs of the body : deep; not intellectual : instinctive, unreasoning — visceral in a sentence visceral adjective (EMOTIONAL) › literary based on deep feeling and emotional reactions rather than on reason or thought: visceral hatred/excitement. visceral pertaining to the viscera or internal organs. Visceral: Referring to the viscera, the internal organs of the body, specifically those within the chest (as the heart or lungs) or abdomen (as the liver, pancreas or intestines). ",0
1124210,i_r_c_1124210,"Tracheids are found in the xylem of all higher plants except certain angiosperms, such as cereals and sedges, in which the water-conducting function is performed by vessels, or tracheae.Tracheids are usually polygonal in cross section; their walls have annular, spiral, or scalene thickenings or rimmed pores.racheids are found in the xylem of all higher plants except certain angiosperms, such as cereals and sedges, in which the water-conducting function is performed by vessels, or tracheae. Tracheids are one of the two types of tracheary elements of vascular plants. Tracheids are elongated cells in the xylem of vascular plants that serve in the transport of water and mineral salts.Tracheids are one of two types of tracheary elements, vessel elements being the other. Tracheids are found in all vascular plants and are the only conducting elements in gymnosperms and ferns.Tracheids have Pits on their end walls. Tracheids are the more primitive of the two cell types, occurring in the earliest vascular plants.arenchyma cells also occur within the xylem and phloem of vascular bundles. Tracheids are found in all vascular plants and are the only conducting elements in gymnosperms and ferns. Tracheids are the more primitive of the two cell types, occurring in the earliest vascular plants. Tracheids are the more primitive of the two cell types, occurring in the earliest vascular plants. Tracheids are the more primitive of the two cell types, occurring in the earliest vascular plants.Tracheids are long and tapered, with angled end-plates that connect cell to cell. Tracheids are less specialized than the vessel members and are the only type of water-conducting cells in most gymnosperms and seedless vascular plants. Tracheids are less specialized than the vessel members and are the only type of water-conducting cells in most gymnosperms and seedless vascular plants. Tracheids are found in all vascular plants, but vessels are only found in flowering plants. Tracheids and vessel elements are distinguished by their shape; vessel elements are shorter, and are connected together into long tubes that are called vessels.Xylem also contains two other cell types: parenchyma and fibers.Xylem can be found: 1 in vascular bundles, present in non-woody plants and non-woody parts of woody plants. Tracheids and vessel elements are distinguished by their shape; vessel elements are shorter, and are connected together into long tubes that are called vessels.Xylem also contains two other cell types: parenchyma and fibers.n most plants, pitted tracheids function as the primary transport cells. Tracheids are present in all vascular plants whereas vessels are confined to angiosperms.Tracheids are thin whereas vessel elements are wide. ",0
490595,i_r_c_490595,"RSA key is a private key based on RSA algorithm. RSA RSA is a public key algorithm invented by Rivest, Shamir and Adleman. RSA encryption is a public key encryption technology developed by RSA Data Security, which licenses the algorithm technologies and also sells the development kits. RSA is a public-key encryption algorithm and the standard for encrypting data sent over the internet. RSA is a public-key encryption algorithm and the standard for encrypting data sent over the internet. RSA encryption is a public-key encryption technology developed by RSA Data Security. RSA numbers, a set of numbers that have as factors two prime numbers (semi-prime keys) RSA Security, a U.S. network security provider, a subsidiary of Dell Technologies. RSA is one of the first practical public-key cryptosystems and is widely used for secure data transmission. RSA is one of the first practical public-key cryptosystems and is widely used for secure data transmission. RSA is one of the first practical public-key cryptosystems and is widely used for secure data transmission. Rivest, Shamir, and Adelman (RSA) is a public-key cryptographic system used for authentication. RSA (cryptosystem) RSA is one of the first practical public-key cryptosystems and is widely used for secure data transmission. RSA is the standard encryption method for important data, especially data that's transmitted over the Internet. RSA (algorithm) RSA is an algorithm used by modern computers to encrypt and decrypt messages. ",0
1103812,i_r_c_1103812,"Boris Yeltsin, president of the Russian Republic, formed the Commonwealth of Independent States (C.I.S.). …Belarus, and Russia formed the Commonwealth of Independent States, which was then joined by eight other former republics of the defunct Soviet Union. commonwealth of independent states The Commonwealth of Independent States (CIS) was established on December 8, 1991, in the Belovezh Accords, which also brought an end to the Soviet Union. The Commonwealth of Independent States (CIS) is the international organization, or alliance of countries that used to form the Soviet Union. ",0
