qid,docno,text,rank
156493,i_r_c_156493,"'Goldfish usually grow with their environment so if they are in a large space and are fed enough, they do sometimes just keep growing. Best Answer: Goldfish do not grow to the size of their tank, that is a myth. Goldfish grow until they are at their mature size, but being in a tank too small for them to grow properly can cause stunting. If kept in a suitable environment, single tail goldfish normally grow to 10 inches (25cm) and can sometimes reach 12 inches (30cm). If kept in a suitable environment, single tail goldfish normally grow to 10 inches (25cm) and can sometimes reach 12 inches (30cm). If kept in a suitable environment, single tail goldfish normally grow to 10 inches (25cm) and can sometimes reach 12 inches (30cm). Most fancy goldfish varieties grow up to 6 or 7 inches long (15 or 18 centimeters), while common and comet goldfish can grow to a foot long (30 centimeters) and even more. A goldfish will grow to the depth of the water it is kept in. A goldfish will grow to the depth of the water it is kept in. If kept in a suitable environment, single tail goldfish normally grow to 10 inches (25cm) and can sometimes reach 12 inches (30cm). If kept in a suitable environment, single tail goldfish normally grow to 10 inches (25cm) and can sometimes reach 12 inches (30cm). Many goldfish can grow over a foot long- here is a list of standard sizes to expect a goldfish to grow: ",0
1110199,i_r_c_1110199,"Bluetooth vs. WiFi - Devices Connected: In Bluetooth, upto 7 devices can be connected to each other (piconet) while in Wi-Fi, the maximum connections depend on Wi-Fi router which can accommodate 1 to several communicating devices at a time. WiFi has a greater range than Bluetooth – perhaps as much as 120 feet indoors, but the actual range may be less. Bluetooth and WiFi are different standards for wireless communication. Bluetooth vs. WiFi - Range: Maximum range for Bluetooth based wireless connections is 30m while for Wi-Fi, it can extend well upto 100m. Bluetooth is a wireless technology developed by Ericsson that is designed to be a cable replacement. Sure, people do it, but it’s a little more involved to set up than WiFi, and a little more involved every time you want to use Bluetooth tethering. Because AirPlay uses your home WiFi network, it supports much greater bandwidth than Bluetooth. Also like WiFi, Bluetooth is “fairly” secure. Unlike WiFi, tethering via Bluetooth isn’t all that common. The choice of Bluetooth or WiFi is clear. ",0
1063750,i_r_c_1063750,"The U.S entered for two main reasons: one was that the Germans had declared unlimited German submarine warfare and the Zimmermann note.The German had totally disregarded the international laws protecting neutral nation's ships by sinking neutral ships.his note was the last straw, causing Wilson to join the war. Best Answer: You need to check your time line-USA entered WW1 in April 1917,some months before the Bolshevik Revolution in Russia that took them out of WW1.USA and Russia were both participants in WW1 for several months in 1917.The situation in Russia had nothing to do with US entry into WW1.f Russia hasn't pulled out of ww1, we(America) wouldn't had entered a war that didnt even touch our soil and possibly hundreds of thousands of Americans wouldn't had lost their lives. The U.S entered WW1 for several reasons. The U.S entered WW1 for several reasons. The U.S entered WW1 for several reasons. US attitude towards WW1 The US didn't want to join the war on anyone's side and followed a policy of isolationism so that they wouldn't be dragged into WW1. … They still sold weapons, ammunition and supplies to whoever was buying them before. The U.S entered for two main reasons: one was that the Germans had declared unlimited German submarine warfare and the Zimmermann note. The U.S entered for two main reasons: one was that the Germans had declared unlimited German submarine warfare and the Zimmermann note. ",0
130510,i_r_c_130510,"A declaratory judgment is one which simply declares the rights of the parties, or expresser, the opinion of the court on a. question of law, without ordering anything to be done. Declaratory judgments are judgment of a court in a civil case that declares the rights, duties, or obligations of each party in a dispute. A declaratory judgment, also called a declaration, is the legal determination of a court that resolves legal uncertainty for the litigants. (14) ‘‘Declaratory judgment’’ is the decision of the Court. in a retirement plan action, a gift valuation action, a gov-. ernmental obligation action, an estate tax installment pay-. ment action, or an exempt organization action. A declaratory judgment, sometimes called declaratory relief, is conclusive and legally binding as to the present and future rights of the parties involved. Wiktionary (0.00 / 0 votes) Rate this definition: declaratory judgment (Noun). The declaratory judgment is generally considered a statutory remedy and not an equitable remedy in the United States, and is thus not subject to equitable requirements, though there are analogies that can be found in the remedies granted by courts of equity. ",0
489204,i_r_c_489204,"It is amazing how many causes of chronic pelvic pain there are; infection, endometriosis, pelvic muscle imbalances, gastrointestinal causes, joint pathology, etc. There are literally dozens of causes of chronic pain in this region. Possible causes of pelvic pain in both men and women may include: Appendicitis; Bladder disorders; Sexually transmitted diseases Some causes of chronic pelvic pain include: Endometriosis. There are many causes of pelvic pain in women including uterine fibroids, cysts, PMS, appendicitis, bladder infections, and unusual vulvar pain. There are many causes of pelvic pain in women including uterine fibroids, cysts, PMS, appendicitis, bladder infections, and unusual vulvar pain. Pelvic Pain Slideshow There are many causes of pelvic pain in women including cysts, PMS, appendicitis, and bladder infections. Other causes of chronic pelvic pain include endometriosis, adenomyosis, and ovulation pain. Occasionally, pelvic pain might be caused by irritation of nerves in the pelvis. Occasionally, pelvic pain might be caused by irritation of nerves in the pelvis. ",0
573724,i_r_c_573724,"Social determinants of health are the economic, social, cultural, and political conditions in which people are born, grow, and live that affect health status. The social determinants of health are the circumstances in which people are born, grow up, live, work and age, and the systems put in place to deal with illness. Social determinants of health are economic and social conditions that influence the health of people and communities [1]. Social determinants of health are economic and social conditions that influence the health of people and communities [1]. Social determinants of health reflect the social factors and physical conditions of the environment in which people are born, live, learn, play, work, and age. Social determinants of health reflect the social factors and physical conditions of the environment in which people are born, live, learn, play, work, and age. Social determinants of health are conditions in the environments in which people are born, live, learn, work, play, worship, and age that affect a wide range of health, functioning, and quality-of-life outcomes and risks. About social determinants of health The social determinants of health are the conditions in which people are born, grow, live, work and age. The social determinants of health (SDOH) are the economic and social conditions and their distribution among the population that influence individual and group differences in health status. 1 Social determinants of health reflect the social factors and physical conditions of the environment in which people are born, live, learn, play, work, and age. The social determinants of health are linked to the economic and social conditions and their distribution among the population that influence individual and group differences in health status. ",0
168216,i_r_c_168216,"Although several other species of the genus Legionella were subsequently identified, L pneumophila is the most frequent cause of human legionellosis and a relatively common cause of community-acquired and nosocomial pneumonia in adults. Legionella pneumophila is the bacterial type that causes the pneumonia known as Legionnaires' disease. Legionella pneumophila is the bacterial type that causes the pneumonia known as Legionnaires' disease. Legionella pneumophila is the bacterial type that causes the pneumonia known as Legionnaires' disease. Legionella pneumophila is the bacterial type that causes the pneumonia known as Legionnaires' disease. Legionella pneumophila is the most common species that causes disease.egionnaires' disease is an infection of the lungs that is a form of pneumonia. 3 Legionella pneumophila causes more than 90% of outbreaks of Legionnaires’ disease, a severe form of pneumonia…. Legionnaires' disease, also known as legionellosis or Legion fever, is a form of atypical pneumonia caused by any type of Legionella bacteria.Over 90% of cases of Legionnaires' disease are caused by Legionella pneumophila.Other causative species include L. longbeachae, L. feeleii, L. micdadei, and L. anisa.egionnaires' disease, also known as legionellosis or Legion fever, is a form of atypical pneumonia caused by any type of Legionella bacteria. Over 90% of cases of Legionnaires' disease are caused by Legionella pneumophila.Other causative species include L. longbeachae, L. feeleii, L. micdadei, and L. anisa.egionnaires' disease, also known as legionellosis or Legion fever, is a form of atypical pneumonia caused by any type of Legionella bacteria. Over 90% of cases of Legionnaires' disease are caused by Legionella pneumophila.Other causative species include L. longbeachae, L. feeleii, L. micdadei, and L. anisa.egionnaires' disease, also known as legionellosis or Legion fever, is a form of atypical pneumonia caused by any type of Legionella bacteria. ",0
1133167,i_r_c_1133167,"For the most part, the average temperature in Jamaica is between 80 °F and 90 °F (27 °FCelsius-29 °Celsius). For the most part, the average temperature in Jamaica is between 80 °F and 90 °F (27 °FCelsius-29 °Celsius). For the most part, the average temperature in Jamaica is between 80 °F and 90 °F (27 °FCelsius-29 °Celsius). Average temperatures in Jamaica range between 80 degrees Fahrenheit and 90 degrees Fahrenheit, with July and August being the hottest months and February the coolest. Average temperatures in Jamaica range between 80 degrees Fahrenheit and 90 degrees Fahrenheit, with July and August being the hottest months and February the coolest. Because the average weather in Jamaica ranges between mid-70s to mid-80s, even during the hurricane season, Jamaica weather is beautiful. Whether it’s Montego Bay Jamaica weather, Falmouth Jamaica weather, Ocho Rios Jamaica weather, Negril Jamaica weather, Runaway Bay Jamaica Weather or any other parts of the island, Jamaica weather is sunshine blue skies. Whereas, December weather has daily highs of 84° F. Visitors to Jamaica choose the best time of year that fits their schedule and their budget. Average temperature in Jamaica in April: 23 to 30°C, 73 to 86°F The Weather in Jamaica is probably warm and cozy because the Bahamas is close to Jamaica so can can infer that is probably war in cozy in Jamaica Like it is in the Bahamas... Jamaica Weather in September: Still Hot & Still Humid. January Weather: Middle of the high season.February Weather: Still middle of the high season.We're getting warmer.rom all the above it would seem as if the best time to visit Jamaica is during the months of December to early April (also known as the dry season). Learn About the Weather of Jamaica The weather patterns you'll encounter in Jamaica can vary dramatically around the island Regardless of when you visit, the tropical climate and warm temperatures of Jamaica essentially guarantee beautiful weather during your vacation. Jamaica Weather in July: Hot, Hot, Hot! Jamaica weather in September is very much like weather in August with one notable exception... ...the possibility of more rain during this month. December Weather in Jamaica: It's high season, and a cool time of year. ",0
527433,i_r_c_527433,"There are three major types of dysarthria in cerebral palsy: spastic, dyskinetic (athetosis) and ataxic. The three types of Cerebral Palsy classified by the type of permanent disability caused by the permanent brain damage suffered during delivery, the permanent brain damage suffered at birth, or the permanent brain damage suffered shortly after birth are the following:Spastic Cerebral Palsy.or more information about spastic cerebral palsy, Click Here. These four main types of cerebral palsy, which are discussed in detail below include:1 Spastic cerebral palsy.2 Athetoid cerebral palsy. These four main types of cerebral palsy, which are discussed in detail below include:1 Spastic cerebral palsy.ypes of Cerebral Palsy. Dysarthria is a feature of many neurological diseases including cerebral palsy, stroke, traumatic brain injury, Parkinson s disease, Amyotrophic Lateral Sclerosis (ALS) and multiple sclerosis. The types of cerebral palsy are: 1 spastic: the most common type of cerebral palsy; reflexes are exaggerated and muscle movement is stiff. The types of cerebral palsy are: 1 spastic: the most common type of cerebral palsy; reflexes are exaggerated and muscle movement is stiff. These four main types of cerebral palsy, which are discussed in detail below include: 1 Spastic cerebral palsy. There are three types of cerebral palsy: Spastic cerebral palsy. It results from impaired movement of the muscles used for speech production, including the lips, tongue, vocal folds, and/or diaphragm.The type and severity of dysarthria depend on which area of the nervous system is affected.ysarthria is caused by damage to the brain. 3 Dysarthria is often caused by strokes, parkinsons disease, ALS, head or neck injuries, surgical accident, or cerebral palsy. Cerebral Palsy has three main types that are classified by the type of permanent disability caused by the permanent brain damage suffered during labor, delivery, shortly after birth.or more information about spastic cerebral palsy, Click Here. 2 dyskinetic: dyskinetic cerebral palsy is divided into two categories.ther Types of Cerebral Palsy. Speech impairments in spastic dysarthria involves four major abnormalities of voluntary movement: spasticity, weakness, limited range of motion and slowness of movement. ",0
1037798,i_r_c_1037798,"Robert Gray is 46-year-old truck driver. Robert Gray, a retired firefighter and truck driver, is the democratic nominee who admitted to the Associated Press that he didn't even vote in Tuesday's election. Robert Gray, a retired firefighter and truck driver, is the democratic nominee who admitted to the Associated Press that he didn't even vote in Tuesday's election. Robert Gray was the Democratic candidate for governor of Mississippi in the 2015 elections. Gray is a truck driver and former firefighter. Captain Robert Gray carries the flag around the world on his sailing vessel (around the tip of South America, to China, and beyond). Robert Gray. Captain Robert Gray, May 1972. On this day before the election we invite you to join us in holding a prayer for Robert Gray for Governor of Mississippi and the other Democratic candidates. Robert Gray told Mississippi Public Broadcasting that he didn’t campaign much, and he didn’t report spending any money on his campaign. Team Mississippi Robert Gray For Governor Offical Page shared a post. Team Mississippi Robert Gray For Governor Offical Page shared a link. On May 11, 1792, Captain Robert Gray entered the mouth of the Columbia River. Team Mississippi Robert Gray For Governor Offical Page. Robert Gray never would have made it without God. Gray, 25, grew up in the impoverished neighborhood of Sandtown-Winchester on Baltimore’s west side. ",0
915593,i_r_c_915593,"Any type of meat—such as beef, pork, lamb, game, or poultry—is ideal for sous vide. Almost any vegetable can also be cooked sous vide with delicious results, as can eggs and many fruits. Eggs come in their own wrappers—their shells—and we can sous vide foods that set as they cook, like custard, yogurt, and chicken liver pâté, in glass canning jars.) With a sous vide cooker, you can cook your eggs anywhere from just-set-enough-that-they-break-when-you-touch-them, to a rich, fudge-like consistency, to hard-boiled with no hint of chalkiness in the yolk. Sous-vide is a method of cooking food sealed in airtight plastic bags in a water bath for longer than normal cooking times—72 hours in some cases—at an accurately regulated temperature much lower than normally used for cooking, typically around 55 °C to 60 °C for meats and higher for vegetables. That said, there are some vegetables for which sous-vide cooking can't be beat. Cooking eggs sous vide also allows you to make flawlessly egg-shaped poached eggs time after time. Sous vide is a culinary technique in which vacuum-sealed food is immersed in a water bath and cooked at a very precise, consistent temperature.This cooking technique typically involves cooking food for longer periods of time at a lower temperature.he term sous vide (pronounced soo–veed) is a French term, meaning under vacuum. 1 sous vide. sous vide pork loin roast. Sous vide is traditionally seen as an alternative method for cooking meats. Sous-vide—French for “under-vacuum”—is an innovative cooking technique in which food is vacuum sealed and slow-cooked in water at constant low temperatures until it’s perfectly cooked through. ",0
264014,i_r_c_264014,"The life cycle of a flea can last anywhere from 20 days to an entire year. The life cycle of a flea can last anywhere from 20 days to an entire year. The total flea life cycle can range from a couple weeks to several months, depending on environmental conditions. A flea can live up to a year, but its general lifespan depends on its living conditions, such as the availability of hosts. A flea can live up to a year, but its general lifespan depends on its living conditions, such as the availability of hosts. The whole cycle can be as quick as 20 days or can last up to one full year; this is because the flea may be in a dormant stage for a long time. Fleas have a complex, 4-stage life cycle. One of the most important things is life cycle of the flea, which depending on the environmental temperature and humidity levels can take between a couple of week to many months. Fleas pass through a complete life cycle of four stages. Author's note: As will be explained later (in sections 2e and 2f), the flea cocoon stage of the fleas life cycle can lay dormant for a long period of time (up to 1 year), waiting for a host animal to come along to trigger it to hatch. Newly emerged adult fleas live only about one week if a blood meal is not obtained. ",0
1121402,i_r_c_1121402,"Farmers can reduce soil erosion by contour plowing. On gentle slopes, plowing along the natural contours of the land or planting crops in strips helps reduce water erosion 4. Terraces are more effective than contour plowing alone in minimizing soil erosion and facilitating infiltration f rainfall into the soil. The plow follows the contours of the land horizontally helping to reduce runoff of water. Definition of contour plowing in US English - plowing along the contours of the land in order to minimize soil erosion. Definition of contour plowing in US English - plowing along the contours of the land in order to minimize soil erosion. These contour lines create a water break which reduces the formation of rills and gullies during times of heavy water run-off; which is a major cause of top soil loss and soil erosion. These contour lines create a water break which reduces the formation of rills and gullies during times of heavy water run-off; which is a major cause of top soil loss and soil erosion. Drought, dust storms, and intensive farming Later, scientists discovered that plowing along the contours of the land would have relieved some of the loss of topsoil. These contour lines create a water break which reduces the formation of rills and gullies during times of heavy water run-off; which is a major cause of soil erosion. A: Contour plowing conserves soil by following the lay of the land and creating ridges that form a water break to prevent soil erosion. ",0
962179,i_r_c_962179,"The Salvation Army, an evangelical part of the universal Christian church established in 1865, has been supporting those in need in His name without discrimination for 130 years in the United States. 1 Salvation Army - San Francisco. General Booth's death in 1912 was a great loss to The Salvation Army. 4 Salvation Army - San Francisco. 2 Salvation Army - San Francisco. From those words came the basis of the foundation deed of The Salvation Army. 3 Salvation Army - San Francisco. 9 Salvation Army - Colma. According to SHARING IS CARING Trademark of Salvation Army, The - Registration Number 2492693 - Serial Number 76180417 :: Justia Trademarks, the Salvation Army has had sharing is caring trademarked since 1950. The Army’s principal legal entity is The Governing Council of The Salvation Army in Canada, a non-profit corporation established by federal statute. 8 Salvation Army - South San Francisco. THE SALVATION ARMY. Francis S. Smith, who was for some time a Salvation Army commissioner in the United States, and William Thomas Stead, one of the most distinguished Victorian journalists and a dedicated supporter of the Salvation Army (later a Titanic victim), contributed to the rise of the Social Wing of the Salvation Army. The Salvation Army is an integral part of the Christian Church, although distinctive in government and practice. The Salvation Army. The Salvation Army is part of the religious umbrella that receives faith-based governmental funding. Given the Salvation Army's mission of serving others through biblical principles grounded in Jesus Christ, lawsuits arise over the funding. ",0
1117099,i_r_c_1117099,"Active margins are areas of convergence where one plate is descending beneath another. Active continental margin: A continental margin that has a very narrow, or even nonexistent, continental shelf and a narrow and steep continental slope that ends in a deep trench instead of a continental rise; it is marked by earthquake and volcanic activity. Active margins are commonly the sites of tectonic activity: earthquakes, volcanoes, mountain building, and the formation of new igneous rock. Active margins are the site of volcanic and earthquake activity. Active margins mark the continents that border the Pacific Ocean where oceanic plates are subducting beneath continental plates.assive continental margin: A continental margin that has a broad continental shelf, a gentle continental slope, and a pronounced continental rise; it is marked by a lack of earthquake and volcanic activity. Active Margins. occur where oceanic lithosphere is being subducted beneath the edge of the continent. the result is a relatively narrow margin that consists of highly deformed sediment that was scraped from the decending lithospheric slab and plastered against the margin of the overriding continent. The active margin is bounded by faults that generate earthquakes when there is movement along them. Active plate margins describe subduction zones and other boundaries where movement is regular and common. An active continental margin is found on the leading edge of the continent where it is crashing into an oceanic plate. The main difference is that active margins are the main sites where tectonic activity takes place (lik … e earthquakes). ",0
