qid,docno,text,rank
1112341,i_r_c_p_1112341,"The following concepts are part of Thai everyday life: ใจเย็น or JAI YEN is more a way of life, it is to keep your temper whatever the situation. T he following concepts are part of Thai everyday life: ใจเย็น or JAI YEN is more a way of life, it is to keep your temper whatever the situation. T hai people are educated in the family and in school to keep frustration inside. Instead of showing their anger toward a problem or situation, Thai people show JAI YEN, i.e. calm or patience. Everyday life or Daily life or Routine life is a phrase used to refer to the ways in which people typically act, think, and feel on a daily basis. Everyday life may be described as considered mundane, routine, natural or habitual. The Thai people or Thais (Thai: ไทยสยาม), formerly known also as Siamese, are a nation and Tai ethnic group native to Southeast Asia, primarily Thailand. Everyday life, daily life or routine life comprises the ways in which people typically act, think, and feel on a daily basis. Everyday life may be described as mundane, routine, natural, habitual, or normal. There is other types of people in Thailand like Chinese, Indian, English, Jamaican. A big part of Thai tradition is having fun and doing so in the middle of roasting hot weather is no exception. Thai people love to have fun together. Thai people love to have fun together. ",0
131843,i_r_c_p_131843,"Definition of SIGMET. plural. SIGMETs. also. sigmets. : a notice of significant hazardous weather conditions (such as extreme turbulence, icing, or poor visibility) in a large area that is provided to the pilot of an aircraft before takeoff — compare airmet. SIGMET, or Significant Meteorological Information, is a weather advisory that contains meteorological information concerning the safety of all aircraft. SIGMET, or Significant Meteorological Information, is a weather advisory that contains meteorological information concerning the safety of all aircraft. sigmet SIGMET, or Significant Meteorological Information, is a weather advisory that contains meteorological information concerning the safety of all aircraft. SIGMET, or Significant Meteorological Information, is a weather advisory that contains meteorological information concerning the safety of all aircraft. ",0
104861,i_r_c_p_104861,"The cost of a concrete floor is economical, about $2 to $6 per square foot depending on the level of complexity. Depending on the level of complexity, concrete floors can cost as little as $2 to $6 a square foot or be as expensive as $15 to $30 a square foot.ven flooring options that are initially cheaper to install than decorative concrete may turn out to be more expensive in the long run. Depending on the level of complexity, concrete floors can cost as little as $2 to $6 a square foot or be as expensive as $15 to $30 a square foot.ideo on the cost of concrete floors. Depending on the level of complexity, concrete floors can cost as little as $2 to $6 a square foot or be as expensive as $15 to $30 a square foot. Integral colored concrete floor cost: $3.75 dollars per square foot, that includes the basic concrete floor package and adding color to the concrete. 10 styrofoam used a lot for radiant heat floors those are the basics of what s included and not included in my concrete floor costs for residential concrete floors my $ 2 50 $ 3 00 dollars per sq ft cost will remain consistent throughout the yearfor commercial concrete floors the cost is anywhere from $ 50 $ 1 00 dollar per sq ft moreif you re trying to figure what the cost for concrete flooring is in your area i would suggest calling a local redi mix concrete company and asking them for 3 referrals they know who does quality work and who doesn te also do a lot of other decorative concrete applications you ll be able to find pricing for stamped concrete stained concrete and more at the bottom of the page my basic cost to pour and finish a concrete floor is $ 2 50 $ 3 00 per square foot Bamboo flooring can cost the consumer between $4 and $6 per square foot.Concrete flooring costs $2 to $15 per square foot, according to Concrete Floors.Basic, single-colored concrete flooring typically costs between $2 and $6 per square foot, while mid-grade concrete with decorative effects can cost between $6 and $8 per square foot.dditional Costs. 2 Interior jobs are slightly more since more work will be required in order to lay concrete in the home.ow much do stained concrete floors cost? 1 For those that want to get acid stained concrete work done outside, a simple stained concrete job can vary anywhere from $2 to $5 per square foot. Because the cost of a cubic yard of concrete has topped $100.00 dollars per yard in a lot of areas around the U.S., it's helpful to know the exact cost in your area.ay's Concrete Floors, Inc is the name of my company. That's $11,040.00 just for the concrete! That's $11,040.00 just for the concrete! In newly constructed homes, concrete floors are about half the price of hardwood floors.Other factors that affect the final cost of your concrete floor project include:oncrete floors can be finished off in the sheen of your choice: high gloss or low gloss. ",0
833860,i_r_c_p_833860,"Historically, Switzerland was a farming country, and the most popular crops and foods include cheese and potatoes as well as chocolate. Italian cuisine is popular in contemporary Switzerland, particularly pasta and pizza. Foods often associated with Switzerland include cheese and chocolate. Italian cuisine is popular in contemporary Switzerland, particularly pasta and pizza. Foods often associated with Switzerland include cheese and chocolate. Historically, Switzerland was a farming country, and the most popular crops and foods include cheese and potatoes as well as chocolate.he food in Europe can be characterized by four categories: meats, sugar, cereals, and fats. 1 Pastetli-This is a popular food in Switzerland. Italian food is very common in modern Switzerland including pasta and pizza. 3 Pot-Fondue this is a Famous swiss food made of melted. Italian food is very common in modern Switzerland including pasta and pizza. Italian food is very common in modern Switzerland including pasta and pizza. Italian food is very common in modern Switzerland including pasta and pizza. 3 Pot-Fondue this is a Famous swiss food made of melted. 5 Cheese-Rosti this is a common swiss dish made from grated potatoes that are raw or. cookedood of Switzerland. Italian food is very common in modern Switzerland including pasta and pizza. 3 Pot-Fondue this is a Famous swiss food made of melted. 5 Cheese-Rosti this is a common swiss dish made from grated potatoes that are raw or. cookedood of Switzerland. Italian food is very common in modern Switzerland including pasta and pizza. Cheese is another food for which Switzerland is known, especially since Switzerland has been producing cheese for many centuries. ",0
207786,i_r_c_p_207786,"Gruber: Mackerel sharks, including great whites, makos, threshers, and porbeagles, have a heat-conserving mechanism known as the rete mirabile (wonderful net), a structure for warming blood passing over the gills. These sharks can raise their temperature about th…e temperature of the water; they need to have occasional short bursts of speed in hunting Cold blooded although if you've ever seen a Great White Shark hunt sea lions you'd be thinking they would have to be hotblooded. Actually the Salmon Shark is a warm blooded shark. Some, like the Mako and the Great white shark, are partially warmblooded (they are endotherms). Actually the Salmon Shark is a warm blooded shark. One striking feature of these warm-bodied sharks is that their flanks and viscera are warm, while the heart and gills are at environmental temperatures. Great white sharks are some of the only warm blooded sharks. It depends on the type of shark, most sharks like living in warm or tropical waters,such as Hawaii and Australia.Some sharks though can live in colder waters,such as the Greenland shark and the Great White shark.The Great White Shark has even been seen in the cold waters of Sanfransisco. More on Warm-Bodied Sharks. Shortfin Mako (Isurus oxyrinchus) A question came across SHARK-L concerning makos being considered warm-blooded and various replies touch upon aspects of the topic. Are sharks cold-blooded or warm-blooded? ",0
1114819,i_r_c_p_1114819,"Durable Medical Equipment (DME) consists of items which: 1 are primarily and customarily used to serve a medical purpose; 2 are not useful to a person in the absence of illness, disability, or injury; 3 are ordered or prescribed by a physician; 4 are reusable; 5 can stand repeated use, and. Durable Medical Equipment (DME) consists of items which: 1 are primarily and customarily used to serve a medical purpose; 2 are not useful to a person in the absence of illness or injury; 3 are ordered or prescribed by a physician; 4 are reusable; 5 can stand repeated use, and. Durable Medical Equipment (DME) consists of items which: 1 are primarily and customarily used to serve a medical purpose; 2 are not useful to a person in the absence of illness, disability, or injury; 3 are ordered or prescribed by a physician; are 1 reusable; can stand repeated use, 2 and. are appropriate for use in the home. Durable Medical Equipment (DME) consists of items which: are primarily and customarily used to serve a medical purpose; are not useful to a person in the absence of illness, disability, or injury; are ordered or prescribed by a physician; are reusable; can stand repeated use, and are appropriate for use in the home. Durable Medical Equipment (DME) consists of items which: are primarily and customarily used to serve a medical purpose; The standard definition of Durable Medical Equipment used by insurance companies is:Durable Medical Equipment (DME) is any equipment that provides therapeutic benefits to a patient in need because of certain medical conditions and/or illnesses.Durable Medical Equipment (DME) consists of items which:1 are primarily and customarily used to serve a medical purpose; 2 are not useful to a person in the absence of illness or injury; 3 are ordered or prescribed by a physician; 4 are reusable; 5 can stand repeated use, and. Durable Medical Equipment (DME) consists of items which: ",0
183378,i_r_c_p_183378,"Definition of exon. : a polynucleotide sequence in a nucleic acid that codes information for protein synthesis and that is copied and spliced together with other such sequences to form messenger RNA — compare intron. Medical Definition of exon. : a polynucleotide sequence in a nucleic acid that codes information for protein synthesis and that is copied and spliced together with other such sequences to form messenger RNA—compare intron. An exon is any part of a gene that codes for a part of the final mature RNA product of that gene after introns have been removed by RNA splicing. The term exon refers to both the DNA sequence within a gene and to the corresponding sequence in RNA transcripts.In RNA splicing, introns are removed and exons are covalently joined to one another as part of generating the mature messenger RNA.he term exon refers to both the DNA sequence within a gene and to the corresponding sequence in RNA transcripts. Exon (disambiguation). may refer to: Exon, a region of DNA that is represented in the mature form of RNA | Exoniensis or Exon., the Post-Nominal Letters for alumni / degrees from the University of Exeter | Exon can also refer to the signature of the Bishop of Exeter | J... en​.wikipedia​.org​/wiki​/Exon (disambiguation). Exons are the nucleotide sequences of genes that are expressed, and those are found at either sides of an intron. Exons are small sequences of genetic code which, via an intermediate step involving RNA, lead to the assembly of sections... By definition, exons and introns are sequences in a protein-coding gene region of a double-stranded DNA molecule (dsDNA) that are expressed as proteins, or intervening sequences not so expressed. ",0
1106007,i_r_c_p_1106007,"Definition of 'visceral'. visceral (vɪsərəl ) Visceral feelings are feelings that you feel very deeply and find it difficult to control or ignore, and that are not the result of thought. visceral ‎(comparative more visceral, superlative most visceral) ( 1 anatomy) Of or relating to the viscera—internal organs of the body; splanchnic. Define visceral: felt in or as if in the internal organs of the body : deep; not intellectual : instinctive, unreasoning — visceral in a sentence visceral adjective (EMOTIONAL) › literary based on deep feeling and emotional reactions rather than on reason or thought: visceral hatred/excitement. visceral pertaining to the viscera or internal organs. Visceral: Referring to the viscera, the internal organs of the body, specifically those within the chest (as the heart or lungs) or abdomen (as the liver, pancreas or intestines). ",0
1124210,i_r_c_p_1124210,"Tracheids are found in the xylem of all higher plants except certain angiosperms, such as cereals and sedges, in which the water-conducting function is performed by vessels, or tracheae.Tracheids are usually polygonal in cross section; their walls have annular, spiral, or scalene thickenings or rimmed pores.racheids are found in the xylem of all higher plants except certain angiosperms, such as cereals and sedges, in which the water-conducting function is performed by vessels, or tracheae. Tracheids are one of the two types of tracheary elements of vascular plants. Tracheids are elongated cells in the xylem of vascular plants that serve in the transport of water and mineral salts.Tracheids are one of two types of tracheary elements, vessel elements being the other. Tracheids are found in all vascular plants and are the only conducting elements in gymnosperms and ferns.Tracheids have Pits on their end walls. Tracheids are found in all vascular plants and are the only conducting elements in gymnosperms and ferns. Tracheids are the more primitive of the two cell types, occurring in the earliest vascular plants.arenchyma cells also occur within the xylem and phloem of vascular bundles. Tracheids are the more primitive of the two cell types, occurring in the earliest vascular plants.Tracheids are long and tapered, with angled end-plates that connect cell to cell. Tracheids are the more primitive of the two cell types, occurring in the earliest vascular plants. Tracheids are the more primitive of the two cell types, occurring in the earliest vascular plants. Tracheids are less specialized than the vessel members and are the only type of water-conducting cells in most gymnosperms and seedless vascular plants. Tracheids are less specialized than the vessel members and are the only type of water-conducting cells in most gymnosperms and seedless vascular plants. Tracheids are found in all vascular plants, but vessels are only found in flowering plants. Tracheids and vessel elements are distinguished by their shape; vessel elements are shorter, and are connected together into long tubes that are called vessels.Xylem also contains two other cell types: parenchyma and fibers.Xylem can be found: 1 in vascular bundles, present in non-woody plants and non-woody parts of woody plants. Tracheids and vessel elements are distinguished by their shape; vessel elements are shorter, and are connected together into long tubes that are called vessels.Xylem also contains two other cell types: parenchyma and fibers.n most plants, pitted tracheids function as the primary transport cells. Tracheids are present in all vascular plants whereas vessels are confined to angiosperms.Tracheids are thin whereas vessel elements are wide. ",0
490595,i_r_c_p_490595,"RSA key is a private key based on RSA algorithm. RSA RSA is a public key algorithm invented by Rivest, Shamir and Adleman. RSA encryption is a public key encryption technology developed by RSA Data Security, which licenses the algorithm technologies and also sells the development kits. RSA is a public-key encryption algorithm and the standard for encrypting data sent over the internet. RSA is a public-key encryption algorithm and the standard for encrypting data sent over the internet. RSA encryption is a public-key encryption technology developed by RSA Data Security. RSA is the standard encryption method for important data, especially data that's transmitted over the Internet. RSA numbers, a set of numbers that have as factors two prime numbers (semi-prime keys) RSA Security, a U.S. network security provider, a subsidiary of Dell Technologies. RSA is one of the first practical public-key cryptosystems and is widely used for secure data transmission. RSA is one of the first practical public-key cryptosystems and is widely used for secure data transmission. RSA is one of the first practical public-key cryptosystems and is widely used for secure data transmission. Rivest, Shamir, and Adelman (RSA) is a public-key cryptographic system used for authentication. RSA (cryptosystem) RSA is one of the first practical public-key cryptosystems and is widely used for secure data transmission. RSA (algorithm) RSA is an algorithm used by modern computers to encrypt and decrypt messages. ",0
1103812,i_r_c_p_1103812,"Boris Yeltsin, president of the Russian Republic, formed the Commonwealth of Independent States (C.I.S.). …Belarus, and Russia formed the Commonwealth of Independent States, which was then joined by eight other former republics of the defunct Soviet Union. commonwealth of independent states The Commonwealth of Independent States (CIS) was established on December 8, 1991, in the Belovezh Accords, which also brought an end to the Soviet Union. The Commonwealth of Independent States (CIS) is the international organization, or alliance of countries that used to form the Soviet Union. ",0
87181,i_r_c_p_87181,"Other causes of left ventricular (LV) hypertrophy, such as long-standing hypertension, amyloidosis, and aortic stenosis must first be excluded before HCM can be diagnosed. Left ventricular hypertrophy that is caused by aortic valve stenosis might require surgery to repair the narrow valve or to replace it with an artificial or tissue valve. Left ventricular hypertrophy may cause or facilitate many cardiac complications of hypertension, including congestive heart failure, ventricular arrhythmias, myocardial ischemia, and sudden death. Left ventricular hypertrophy results from an increase in left ventricular workload, e.g., during hypertension or aortic valve stenosis. Left Ventricular Hypertrophy (LVH) causes a similar pattern of repolarization abnormalities as LBBB, with ST elevation in the leads with deep S-waves (usually V1-3) and ST depression/T-wave inversion in the leads with tall R waves (I, aVL, V5-6). Left ventricular hypertrophy is enlargement and thickening (hypertrophy) of the walls of your heart's main pumping chamber (left ventricle). Left ventricular hypertrophy can develop in response to some factor — such as high blood pressure or a heart condition — that causes the left ventricle to work harder. Left ventricular hypertrophy can occur when some factor makes your heart work harder than normal to pump blood to your body. This is the most common cause of left ventricular hypertrophy. Left ventricular hypertrophy can occur when some factor makes your heart work harder than normal to pump blood to your body. Hypertrophy is usually what causes left ventricular enlargement. Hypertrophy is usually what causes left ventricular enlargement. Hypertrophy is usually what causes left ventricular enlargement. Hypertrophy is the usually what causes left ventricular enlargement. Left ventricular hypertrophy is thought to be the leading cause of sudden cardiac death in the adult population. Ventricular hypertrophy can be part of various syndromes caused by any of various underlying diseases. Left ventricular hypertrophy is a disorder of the heart involving the enlargement or thickening of the wall of cardiac muscle situated in the chamber of the heart known as the left ventricle. Left ventricular hypertrophy (LVH) is a condition in which the muscle wall of heart’s left pumping chamber (ventricle) becomes thickened (hypertrophy). This is important because left ventricular hypertrophy is one of the most common causes of ST segment elevation in chest pain patients.Many 12 lead ECG classes teach paramedics to recognize the voltage […]. Ventricular hypertrophy can result from a variety of conditions, both adaptive and maladaptive. Left ventricular hypertrophy is more common in people who have uncontrolled high blood pressure. ",0
443396,i_r_c_p_443396,"LPS Act. a California law named for sponsors of the legislation (Lanterman, Petris, and Short) that provides for the protection and treatment of persons judged to be gravely disabled and thus unable to provide food, clothing, or shelter for themselves. A limited partnership (LP) is a form of partnership similar to a general partnership, except that where a general partnership must have at least two general partners (GPs), a limited partnership must have at least one GP and at least one limited partner. one doing business in any other state. -lp must file an application for registration. -new state issues a certificate of registration, allowing the lp to utilize all assets of that state. -- law of the state in which the lp is formed is the law that governs the ops organization, internal affairs, and liability of its limited partners. Limited Partnership (LP) An LP is a form of partnership that has two types of partners: a general partner and limited partners. A typical law states, in part, An LP-gas container shall be filled only by the owner or upon the owner's authorization.. The label LPS indicates that the truck is LPG-fueled, that it meets the requirements of LP, and that it is equipped with components that can protect its electrical system, fuel system, and exhaust system from the environment. A limited partnership (LP) consists of two or more persons, with at least one general partner and one limited partner. ",0
1121709,i_r_c_p_1121709,"AB-positive: 3 percent. 8 percent (5 percent + 3 percent). All other denomina-tions and forms of synagogue identification have 3 percent or less of the synagogues: Reconstructionist (3 percent), Sephardi (3 percent), Traditional (1 percent), Humanistic (1 percent), 3 Three days before ovulation: 8 percent to 23 percent. 3 30 percent of what they SEE. 3 25 percent to 50 percent annually: Very rapid growth. Start with a 10 percent incline, followed by 6 percent, 10 percent, 7 percent, 12 percent, 10 percent and 12 percent, in that order. 2 Fifteen percent have operated for three to five years, 16 percent for one to two years and 8 percent for less than a year. The ranges for this classification are between 25 percent and 30 percent for women ages 19 to 29, 26 percent and 32 percent for women in their 30s, 29 percent and 34 percent for women in their 40s, and between 34 percent and 38 percent for women ages 50 and older. ",0
87452,i_r_c_p_87452,"Suicide was the third leading cause of Canadian military deaths after motor vehicle accidents and cancerin a newly published study of 25 years of death records. War was the leading cause of death in the military nearly every year between 2004 and 2011 until suicides became the top means of dying for troops in 2012 and 2013, according to a bar chart published this week in a monthly Pentagon medical statistical analysis journal. War was the leading cause of death in the military nearly every year between 2004 and 2011 until suicides became the top means of dying for troops in 2012 and 2013, according to a bar chart published this week in a monthly Pentagon medical statistical analysis journal. War was the leading cause of death in the military nearly every year between 2004 and 2011 until suicides became the top means dying for in 2012 and 2013, according to a bar chart published this week in a. War was the leading cause of death in the military nearly every year between 2004 and 2011 until suicides became the top means dying for in 2012 and 2013, according to a bar chart published this week in a. The number of suicides among America's troops, averaging nearly one a day this year, has become the second leading cause of death among the military at the fastest pace in the nation's decade of war. According to the World Health Organization (WHO), it’s the leading cause of disability, a major contributor to global disease, and it leads to suicide — and some people may be prone to it more than others.fter transgendered people, teenagers who have had family in the military have been found to experience more depression, hopelessness, and suicidal thoughts than their peers without family in the military. The largest study to date of a rising suicide rate among military personnel, published Wednesday in JAMA Psychiatry, found no connection between suicide and deployment overseas in support of the wars in Iraq and Afghanistan.he study found that the suicide rate for troops who left the military before completing a four-year enlistment was nearly twice that of troops who stayed. ",0
