qid,docno,text,rank
1114819,i_c_1114819,"Durable Medical Equipment (DME) is any equipment that provides therapeutic benefits to a patient in need because of certain medical conditions and/or illnesses. Durable Medical Equipment (DME) consists of items which: 1  are primarily and customarily used to serve a medical purpose; 2  are not useful to a person in the absence of illness, disability, or injury; 3  are ordered or prescribed by a physician; 4  are reusable; 5  can stand repeated use, and. 6  are appropriate for use in the home. Durable medical equipment. Durable Medical Equipment (DME) is any equipment that provides therapeutic benefits to a patient in need because of certain medical conditions and/or illnesses. Durable Medical Equipment (DME) consists of items which: are primarily and customarily used to serve a medical purpose; are not useful to a person in the absence of illness, disability, or injury; are ordered or prescribed by a physician; are reusable; can stand repeated use, and are appropriate for use in the home. (Learn how and when to remove these template messages) Durable Medical Equipment (DME) is any equipment that provides therapeutic benefits to a patient in need because of certain medical conditions and/or illnesses. Durable Medical Equipment (DME) consists of items which: 1  are primarily and customarily used to serve a medical purpose; 2  are not useful to a person in the absence of illness, disability, or injury; 3  are ordered or prescribed by a physician;  are 1  reusable; can stand repeated use, 2  and. are appropriate for use in the  home.",0
183378,i_c_183378,"Definition of exon. : a polynucleotide sequence in a nucleic acid that codes information for protein synthesis and that is copied and spliced together with other such sequences to form messenger RNA — compare intron. Medical Definition of exon. : a polynucleotide sequence in a nucleic acid that codes information for protein synthesis and that is copied and spliced together with other such sequences to form messenger RNA—compare intron. For other uses, see Exon (disambiguation) . An exon is any part of a gene that codes for a part of the final mature RNA product of that gene after introns have been removed by RNA splicing. The term exon refers to both the DNA sequence within a gene and to the corresponding sequence in RNA transcripts. In RNA splicing, introns are removed and exons are covalently joined to one another as part of generating the mature messenger RNA.",0
1106007,i_c_1106007,"Definition of Visceral. Visceral: Referring to the viscera, the internal organs of the body, specifically those within the chest (as the heart or lungs) or abdomen (as the liver, pancreas or intestines). In a figurative sense, something visceral is felt deep down.. It is a gut feeling.. Definition of visceral. 1 : felt in or as if in the internal organs of the body : deep a visceral conviction. 2 : not intellectual : instinctive, unreasoning visceral drives. 3 : dealing with crude or elemental emotions : earthy a visceral novel. Definition of 'visceral'. visceral (vɪsərəl ) Visceral feelings are feelings that you feel very deeply and find it difficult to control or ignore, and that are not the result of thought. I never overcame a visceral antipathy for the monarchy. ...the sheer visceral joy of being alive.",0
1124210,i_c_1124210,"Its major components include xylem parenchyma, xylem fibers, tracheids, and xylem vessels. Tracheids are one of the two types of tracheary elements of vascular plants. (The other being the vessel elements). A tracheid cell loses its protoplast at maturity. Thus, at maturity, it becomes one of the non-living components of the xylem. Tracheid of oak shows pits along the walls. It is longer than a vessel element and has no perforation plates. Tracheids are elongated cells in the xylem of vascular plants that serve in the transport of water and mineral salts.Tracheids are one of two types of tracheary elements, vessel elements being the other. Tracheids, unlike vessel elements, do not have perforation plates.racheids provide most of the structural support in softwoods, where they are the major cell type. Because tracheids have a much higher surface to volume ratio compared to vessel elements, they serve to hold water against gravity (by adhesion) when transpiration is not occurring. Tracheid. a dead lignified plant cell that functions in water conduction. Tracheids are found in the xylem of all higher plants except certain angiosperms, such as cereals and sedges, in which the water-conducting function is performed by vessels, or tracheae.Tracheids are usually polygonal in cross section; their walls have annular, spiral, or scalene thickenings or rimmed pores.racheids are found in the xylem of all higher plants except certain angiosperms, such as cereals and sedges, in which the water-conducting function is performed by vessels, or tracheae. Tracheids are usually polygonal in cross section; their walls have annular, spiral, or scalene thickenings or rimmed pores.",0
490595,i_c_490595,"What is an RSA key used for? RSA key is a private key based on RSA algorithm. Private Key is used for authentication and a symmetric key exchange during establishment of an SSL/TLS session. It is a part of the public key infrastructure that is generally used in case of SSL certificates. RSA (cryptosystem) RSA is one of the first practical public-key cryptosystems and is widely used for secure data transmission. In such a cryptosystem, the encryption key is public and different from the decryption key which is kept secret (private). RSA is a cryptosystem for public-key encryption, and is widely used for securing sensitive data, particularly when being sent over an insecure network such as the Internet.",0
1103812,i_c_1103812,"…Belarus, and Russia formed the Commonwealth of Independent States, which was then joined by eight other former republics of the defunct Soviet Union. The Commonwealth of Independent States (CIS) is the international organization, or alliance of countries that used to form the Soviet Union. On December 8 1991, leaders of Russia, Belarus, and Ukraine met at the nature reserve called Belovezhskaya Pushcha in Belarus. They discussed the creation of the Commonwealth of Independent States (CIS). They reached an agreement about many points and signed a document creating the CIS. One of these points stated that the alliance would be open to all the republics of the Soviet Union. commonwealth of independent states The Commonwealth of Independent States (CIS) was established on December 8, 1991, in the Belovezh Accords, which also brought an end to the Soviet Union.",0
87181,i_c_87181,"Left ventricular hypertrophy can occur when some factor makes your heart work harder than normal to pump blood to your body. Factors that can cause your heart to work harder include: High blood pressure (hypertension). This is the most common cause of left ventricular hypertrophy. More than one-third of people show evidence of left ventricular hypertrophy at the time of their diagnosis with hypertension. Aortic valve stenosis. By Mayo Clinic Staff. Left ventricular hypertrophy can occur when some factor makes your heart work harder than normal to pump blood to your body. Factors that can cause your heart to work harder include: High blood pressure (hypertension). This is the most common cause of left ventricular hypertrophy. More than one-third of people show evidence of left ventricular hypertrophy at the time of their diagnosis with hypertension. Left ventricular hypertrophy may cause or facilitate many cardiac complications of hypertension, including congestive heart failure, ventricular arrhythmias, myocardial ischemia, and sudden death. Left ventricular diastolic dysfunction, which may present with all of the symptoms and signs of congestive heart failure, is common in patients with long-standing hypertension.",0
443396,i_c_443396,"LPS Act. LPS Act. a California law named for sponsors of the legislation (Lanterman, Petris, and Short) that provides for the protection and treatment of persons judged to be gravely disabled and thus unable to provide food, clothing, or shelter for themselves. Corporate law. A limited partnership (LP) is a form of partnership similar to a general partnership, except that where a general partnership must have at least two general partners (GPs), a limited partnership must have at least one GP and at least one limited partner. one doing business in any other state. -lp must file an application for registration. -new state issues a certificate of registration, allowing the lp to utilize all assets of that state. -- law of the state in which the lp is formed is the law that governs the ops organization, internal affairs, and liability of its limited partners.",0
1121709,i_c_1121709,"1 10 percent of what they READ. 2  20 percent of what they HEAR. 3  30 percent of what they SEE. 4  50 percent of what they SEE and HEAR. 5  70 percent of what they SAY and WRITE.  90 percent of what they DO. ber of synagogues was Orthodox (40 percent), followed by Reform (26 percent), and Conservative (23 percent). All other denomina-tions and forms of synagogue identification have 3 percent or less of the synagogues: Reconstructionist (3 percent), Sephardi (3 percent), Traditional (1 percent), Humanistic (1 percent), The ranges for this classification are between 25 percent and 30 percent for women ages 19 to 29, 26 percent and 32 percent for women in their 30s, 29 percent and 34 percent for women in their 40s, and between 34 percent and 38 percent for women ages 50 and older.",0
87452,i_c_87452,"Suicide rates in the military were traditionally lower than among civilians in the same age range, but in 2004 the suicide rate in the U.S. Army began to climb, surpassing the civilian rate in 2008. Substance use is involved in many of these suicides. The 2010 report of the Army Suicide Prevention Task Force found that 29 percent of active duty Army suicides from fiscal year (FY) 2005 to FY 2009 involved alcohol or drug use; and in 2009, prescription drugs were involved in almost one third of them. Combat Fatalities not the Most Common Cause of Military Deaths. Suicide was the third leading cause of Canadian military deaths after motor vehicle accidents and cancerin a newly published study of 25 years of death records. Even though the jury is out on whether suicide prevention programs work, Lt.-Col. The findings are the latest in a series of studies prompted by a military suicide rate that has nearly doubled since 2005. The study’s authors and others cautioned, however, that the findings do not rule out combat exposure as a reason for the increase in suicides, adding that more information was needed.he study found that the suicide rate for troops who left the military before completing a four-year enlistment was nearly twice that of troops who stayed. The rate for troops who were involuntarily discharged under less-than-honorable conditions for disciplinary infractions was nearly three times higher.",0
855410,i_c_855410,"The main ingredient in this Theraderm cream is lanolin, which is a chemical obtained from sheep’s wool. Lanolin is often used in skin care products because of its ability to boost the natural moisture barrier, as well as the ability to draw moisture to the application site. Theraderm is a manufacturer of clinical-grade skin care products, including anti-aging creams and moisturizers, as well as an acne system under an alternate brand: Reversion. The company was founded in 1996 by James Beckman, M.D., and is headquartered in Springdale, Arkansas. Theraderm Skin Renewal System. Theraderm Skin Renewal System is described as a total skincare system that may produce younger looking skin. This 5-product system is said to reduce fine lines, take care of rough skin and address sun damage. However, this system has received some low scores on consumer-driven websites that rate anti-aging products, which makes us wonder if this system does not live up to expectations.",0
1114646,i_c_1114646,"Famciclovir (Famvir®) is a prescription antiviral medication used to treat the following conditions: Herpes simplex infections (including cold sores and genital herpes) in people with HIV or other conditions that weaken the immune system. Famciclovir (Famvir®) is a prescription antiviral medication used to treat the following conditions: Shingles in people with normal immune systems. Recurring genital herpes in people with normal immune systems. Recurring cold sores in people with normal immune systems. Famciclovir (Famvir) is a drug used for the treatment of genital herpes, cold sores, shingles, and chickenpox. Side effects, drug interactions, warnings and precautions, and pregnancy information should be reviewed prior to taking this medication.",0
19335,i_c_19335,"Environmental anthropology is a sub-specialty within the field of anthropology that takes an active role in examining the relationships between humans and their environment across space and time.pplied anthropology utilizes these understandings to work with people on a local basis as well as trying to satisfy share holders working to gain a resolution for problems related to health, education, social welfare, development and environmental protection. Ecological anthropology is defined as the study of cultural adaptations to environments. The sub-field is also defined as, the study of relationships between a population of humans and their biophysical environment .he abstract noun anthropology is first attested in reference to history. Its present use first appeared in Renaissance Germany in the works of Magnus Hundt and Otto Casmann. Their New Latin anthropologia derived from the combining forms of the Greek words anthrōpos (ánthrōpos,  ἄνθρωπος ) human and (logos,  lógos ). λόγος study Medical Definition of ANTHROPOLOGY. : the science of humans; especially: the study of humans in relation to distribution, origin, classification, and relationship of races, physical character, environmental and social relations, and culture. — an·thro·po·log·i·cal \-pə-ˈlaej-ˈläj-i\ kəl. adjectiveull Definition of ANTHROPOLOGY. 1. : the science of human beings; especially: the study of human beings and their ancestors through time and space and in relation to physical character, environmental and social relations, and culture.",0
47923,i_c_47923,"axon terminal = synaptic end bulb - The swollen or knob-like distal endings to the terminal branches of axons (and axon collaterals) which house the secretory components of the neuron; the site of synthesis, packaging, storage and release of neurotransmitter molecules. Definition. noun, singular: axon terminal. Button-like endings of axons through which axons make synaptic contacts with other nerve cells or with effector cells. Supplement. noun, singular: axon terminal. Button-like endings of axons through which axons make synaptic contacts with other nerve cells or with effector cells. Supplement. Axon terminals refer to the axon endings that are somewhat enlarged and often club-or button-shaped.",0
405717,i_c_405717,"Roissy - Charles de Gaulle airport (CDG) is the main international airport for Paris, and the second busiest airport in Europe after London Heathrow. The two main terminals are Terminal 1, used by most foreign airlines, and Terminal 2, used by Air France, its partners, and some other European flights including Easyjet. Paris Charles de Gaulle Airport IATA: CDG, ICAO: LFPG also known as Roissy Airport (name of the local district), is the largest international airport in France. It is named after Charles de Gaulle (1890–1970), leader of the Free French Forces during the Second World War, founder of the French Fifth Republic and President of France from 1959 to 1969. Charles de Gaulle Airport is located within portions of several communes 25 km (16 mi) to the northeast of Paris. Paris Charles de Gaulle Airport (CDG) is one of the busiest passenger airports in Europe and is the larger of Paris' two airports... Charles de Gaulle Airport is 14 miles (23 kilometers) northeast of Paris and has extensive road and rail links to the capital city and beyond. Getting to Paris from Charles de Gaulle is easy with RATP buses, taxis and limousines all operating from Paris CDG.",0
182539,i_c_182539,"Monotonic Function. Monotonic functions are the functions which maintained the order of functions value. As we all know that the variation in independent value also make the variation in functions value. A suitable example for this is monotonic functions or linear polynomials. The monotonic functions maintains the straight line in linear programming graph. This is also called the monotonic nature over the domain and real numbers. A monotonic function increases and decreases over the interval. Montonic Function. When a function is increasing on its entire domain or decreasing on its entire domain, we say that the function is strictly monotonic, and we call it a monotonic function. For example, consider the function g(x) equals x 3: Notice the graph of g is increasing everywhere. Therefore, this is a monotonic function. To solidify our understanding of what a monotonic function is, let's consider what a non-monotonic function is. A non-monotonic function is a function that is increasing and decreasing on different intervals of its domain. For example, consider our initial example f(x) equals x 2.",0
1113437,i_c_1113437,"spruce - any coniferous tree of the genus Picea. genus Picea, Picea - a genus of temperate and Arctic evergreen trees (see spruce) spruce - light soft moderately strong wood of spruce trees; used especially for timbers and millwork. Description: 1  White spruce is a medium-sized conifer found in northeastern United States and throughout Canada. It is the state tree of South Dakota. White spruce has a cone-shaped crown, and when grown in the open develops a conical crown which extends nearly to the ground. The Norway Spruce, a European native, was probably the original Christmas tree. The Blue Spruce is the state tree of Colorado and Utah, plus the U.S. National Christmas Tree is also a Blue Spruce. Description . Spruce trees are large, with some species maturing up to 200 feet tall. They have a strongly conical shape, especially when they are young.",0
1129237,i_c_1129237,"User: Hydrogen is a liquid below what temperature? a. 100 degrees C c. -183 degrees C b. -253 degrees C d. 0 degrees C Weegy: Hydrogen is a liquid below 253 degrees C. User: What is the boiling point of oxygen? a. 100 degrees C c. -57 degrees C b. 8 degrees C d. -183 degrees C Weegy: The boiling point of oxygen is -183 degrees C. Hydrogen's state of matter is gas at standard conditions of temperature and pressure. Hydrogen condenses into a liquid or freezes solid at extremely cold... Hydrogen's state of matter is gas at standard conditions of temperature and pressure. Hydrogen condenses into a liquid or freezes solid at extremely cold temperatures. Hydrogen's state of matter can change when the temperature changes, becoming a liquid at temperatures between minus 423.18 and minus 434.49 degrees Fahrenheit. It becomes a solid at temperatures below minus 434.49 F.Due to its high flammability, hydrogen gas is commonly used in combustion reactions, such as in rocket and automobile fuels. Hydrogen gas has the molecular formula H 2. At room temperature and under standard pressure conditions, hydrogen is a gas that is tasteless, odorless and colorless. Hydrogen can exist as a liquid under high pressure and an extremely low temperature of 20.28 kelvin (−252.87°C, −423.17 °F). Hydrogen is often stored in this way as liquid hydrogen takes up less space than hydrogen in its normal gas form. Liquid hydrogen is also used as a rocket fuel.",0
146187,i_c_146187,"There is a discernible difference between the two burgers, especially in the meat quality. The McDouble contains gristle and carry's a different flavor than the Double Cheeseburger. The double cheeseburger tastes more like beef. The McDouble tastes of whatever meat filler they use to fill the gap. A double cheesburger has 2 slices of cheese with 2 meat patties. A mcdouble on the other hand only had 1 slice of cheese, but still 2 pieces of meat. I say had because mcdoubles arent sold in Australia (maybe a few stores but not a regular menu item) anymore. Other countries might be different but that's the difference in Australia. The McDouble is listed as a slice of American cheese between two 100% beef patties, topped with pickles, onions, ketchup and mustard. mcdonalds.com. The Double Cheeseburger is listed as two slices of golden American cheese with two 100% all beef patties, pickles, onions, ketchup and mustard.",0
