qid,docno,text,rank
156493,i_c_156493,"Rating Newest Oldest. Best Answer: Goldfish do not grow to the size of their tank, that is a myth. Goldfish grow until they are at their mature size, but being in a tank too small for them to grow properly can cause stunting. This is where the idea that they grow to the size of their tank comes from. 'Goldfish usually grow with their environment so if they are in a large space and are fed enough, they do sometimes just keep growing. 'If you went and checked the lakes and ponds across the country you could probably find a goldfish about Bob's size, but having one in a tank like this is most unusual and I have not heard of one. A goldfish will grow to the depth of the water it is kept in. If the tank is not large enough to allow the goldfish to grow, it's growth will be stunted and this can cause the fish to become unhealthy and die. The fancy goldfish do not get as large as the common/comet/shubunkin/feeder goldfish.",0
1110199,i_c_1110199,"The choice of Bluetooth or WiFi is clear. Bluetooth is a universal standard and easy to use. But, its range is quite limited and sound quality is restricted. WiFi systems have a wider range and can offer excellent fidelity. But, different systems that use WiFi are incompatible, and setup may be difficult. Bluetooth vs. WiFi - Range: Maximum range for Bluetooth based wireless connections is 30m while for Wi-Fi, it can extend well upto 100m. In Wi-Fi, range depends on the version of Wi-Fi protocol applied and addition of antennas in the communication system while no such concerns of range or extra antenna are much known in Bluetooth. . Bluetooth vs. WiFi - Devices Connected: In Bluetooth, upto 7 devices can be connected to each other (piconet) while in Wi-Fi, the maximum connections depend on Wi-Fi router which can accommodate 1 to several communicating devices at a time. Bluetooth and WiFi are different standards for wireless communication. Bluetooth technology is useful when transferring information between two or more devices that are near each other when speed is not an issue, such as telephones, printers, modems and headsets.",0
1063750,i_c_1063750,"The U.S entered WW1 for several reasons. The U.S entered for two main reasons: one was that the Germans had declared unlimited German submarine warfare and the Zimmermann note.The German had totally disregarded the international laws protecting neutral nation's ships by sinking neutral ships.his note was the last straw, causing Wilson to join the war. The Zimmermann note and unlimited German submarine warfare were two of the biggest cause for the U.S to join the Allies and go to war with Germany. During the war Germany did... The U.S entered WW1 for several reasons. The U.S entered for two main reasons: one was that the Germans had declared unlimited German submarine warfare and the Zimmermann note. The German had totally disregarded the international laws protecting neutral nation's ships by sinking neutral ships. The U.S entered WW1 for several reasons. The U.S entered for two main reasons: one was that the Germans had declared unlimited German submarine warfare and the Zimmermann note.",0
130510,i_c_130510,"Wiktionary (0.00 / 0 votes) Rate this definition: declaratory judgment (Noun). A ruling of a court in a civil case which declares the rights, duties, or obligations of each party in a dispute, but does not necessarily award any damages or other relief. A declaratory judgment is one which simply declares the rights of the parties, or expresser, the opinion of the court on a. question of law, without ordering anything to be done. Declaratory judgments are judgment of a court in a civil case that declares the rights, duties, or obligations of each party in a dispute. However, a declaratory judgment does not order any action or result in any award of damages to any party to the case.",0
489204,i_c_489204,"Causes of Pelvic Pain. Acute pelvic pain is pain that starts over a short period of time anywhere from a few minutes to a few days. This type of pain is often a warning sign that something is wrong and should be evaluated promptly. Pelvic pain can be caused by an infection or inflammation. An infection doesn't have to affect the reproductive organs to cause pelvic pain. Pain caused by the bladder, bowel, or appendix can produce pain in the pelvic region; diverticulitis, irritable bowel syndrome, kidney or bladder stones, as well as muscle spasms or strains are some examples of non-reproductive causes of pelvic or lower abdominal pain. Some causes of chronic pelvic pain include: 1  Endometriosis. This is a condition in which tissue from the lining of your womb (uterus) grows outside your uterus. 2  Tension in your pelvic floor muscles. Spasms or tension in the pelvic floor muscles can lead to recurring pelvic pain. 3  Chronic pelvic inflammatory disease. Although pelvic pain often refers to pain in the region of women's internal reproductive organs, pelvic pain can be present in men, too, and can stem from multiple causes. Pelvic pain may be a symptom of infection or may arise from pain in the pelvic bone or in non-reproductive internal organs, such as the bladder or colon. In women, however, pelvic pain can very well be an indication that there may be a problem with one of the reproductive organs in the pelvic area (uterus, ovaries, fallopian tubes, cervix, or vagina). What Causes Pelvic Pain? Possible causes of pelvic pain in both men and women may include: Appendicitis; Bladder disorders; Sexually transmitted diseases",0
573724,i_c_573724,"What are the social 'determinants' of health? The social determinants of health are the circumstances in which people are born, grow up, live, work and age, and the systems put in place to deal with illness. These circumstances are in turn shaped by a wider set of forces: economics, social policies, and politics. About social determinants of health The social determinants of health are the conditions in which people are born, grow, live, work and age. These circumstances are shaped by the distribution of money, power and resources at global, national and local levels. The social determinants of health are mostly responsible for health inequities - the unfair and avoidable differences in health status seen within and between countries. Key concepts Social determinants of health are economic and social conditions that influence the health of people and communities [1]. These conditions are shaped by the amount of money, power, and resources that people have, all of which are influenced by policy choices.Social determinants of health affect factors that are related to health outcomes.eterminants of health are factors that contribute to a person's current state of health. These factors may be biological, socioeconomic, psychosocial, behavioral, or social in nature. Scientists generally recognize five determinants of health of a population [2, 3]: 1  Genes and biology: for example, sex and age.",0
168216,i_c_168216,"Although several other species of the genus Legionella were subsequently identified, L pneumophila is the most frequent cause of human legionellosis and a relatively common cause of community-acquired and nosocomial pneumonia in adults. Legionnaires disease (LD) is the pneumonia caused by Legionella pneumophila. LD also refers to a more benign, self-limited, acute febrile illness known as Pontiac fever, which has been linked serologically to L pneumophila, although it presents without pneumonia. (See Pathophysiology and Etiology.) Background. Legionnaires disease (LD) is the pneumonia caused by Legionella pneumophila. LD also refers to a more benign, self-limited, acute febrile illness known as Pontiac fever, which has been linked serologically to L pneumophila, although it presents without pneumonia.",0
1133167,i_c_1133167,"It is always important to know what the weather in Jamaica will be like before you plan and take your vacation. For the most part, the average temperature in Jamaica is between 80 °F and 90 °F (27 °FCelsius-29 °Celsius). Luckily, the weather in Jamaica is always vacation friendly. You will hardly experience long periods of rain fall, and you will become accustomed to weeks upon weeks of sunny weather. You will find the mountainous area cooler than the lower lying land right throughout the year. It is always important to know what the weather in Jamaica will be like before you plan and take your vacation. For the most part, the average temperature in Jamaica is between 80 °F and 90 °F (27 °FCelsius-29 °Celsius). Luckily, the weather in Jamaica is always vacation friendly. You will hardly experience long periods of rain fall, and you will become accustomed to weeks upon weeks of sunny weather. Weather in Jamaica. The weather patterns you'll encounter in Jamaica can vary dramatically around the island. Photo credit: © Dennis Sabo | Dreamstime.com. Regardless of when you visit, the tropical climate and warm temperatures of Jamaica essentially guarantee beautiful weather during your vacation. Average temperatures in Jamaica range between 80 degrees Fahrenheit and 90 degrees Fahrenheit, with July and August being the hottest months and February the coolest.",0
527433,i_c_527433,"There are three major types of dysarthria in cerebral palsy: spastic, dyskinetic (athetosis) and ataxic. Speech impairments in spastic dysarthria involves four major abnormalities of voluntary movement: spasticity, weakness, limited range of motion and slowness of movement. Dysarthria is a motor speech disorder. It results from impaired movement of the muscles used for speech production, including the lips, tongue, vocal folds, and/or diaphragm.The type and severity of dysarthria depend on which area of the nervous system is affected.ysarthria is caused by damage to the brain. This may occur at birth, as in cerebral palsy or muscular dystrophy, or may occur later in life due to one of many different conditions that involve the nervous system, including. 1  stroke, The types of cerebral palsy are: 1  spastic: the most common type of cerebral palsy; reflexes are exaggerated and muscle movement is stiff. 2  dyskinetic: dyskinetic cerebral palsy is divided into two categories.ther Types of Cerebral Palsy. Symptoms of other types of cerebral palsy may also include floppy muscle tone and lack of muscle coordination. Tremors or an unsteady gait are also common.",0
1037798,i_c_1037798,"Robert Gray was the Democratic candidate for governor of Mississippi in the 2015 elections. Gray won the Democratic primary on August 4, 2015, and was defeated by incumbent Governor Phil Bryant (R) in the general election on November 3, 2015. Gray is a truck driver and former firefighter. He gained national attention for admitting that he did not vote in the August 4, 2015, primary, saying, I was in Jackson and had to do a lot of stuff and just lost track of time, to tell you the truth.. Gray made the following statement about his primary victory: Robert Gray. A surprise came on the Democratic side in the race for Mississippi Governor. Robert Gray, a retired firefighter and truck driver, is the democratic nominee who admitted to the Associated Press that he didn't even vote in Tuesday's election. I'm not a politician, said Gray in a Wednesday interview. I'm not a person who really wanted to run for Governor.. Robert Gray is 46-year-old truck driver. That schedule prevented him from campaigning, aside from a couple of small events. He also didn't fundraise at all. So with no money in the campaign bank, a man who admits he usually shies away from attention, clinched the nomination. It doesn't take a brain surgeon to do what needs to be done in the state of Mississippi, explained Gray. Gray wants to see more money brought into the state.",0
915593,i_c_915593,"All kinds! Any type of meat—such as beef, pork, lamb, game, or poultry—is ideal for sous vide. It works especially well with fish and seafood, ensuring that these delicate foods are not overcooked. Almost any vegetable can also be cooked sous vide with delicious results, as can eggs and many fruits. You can even use it to make custard-style ice cream base, béarnaise sauce, crème Anglaise, custards, cheese, yogurt, and even cakes. What kind of foods can you cook sous vide? Sous vide is traditionally seen as an alternative method for cooking meats. However, the technique is extremely versatile, meaning all manner of ingredients can be cooked such as: Pork, Lamb, Beef, Chicken, Duck, Turkey, Quail. Often, however, when you prepare food sous vide you’re packaging the food in plastic. (Often but not always. Eggs come in their own wrappers—their shells—and we can sous vide foods that set as they cook, like custard, yogurt, and chicken liver pâté, in glass canning jars.)",0
264014,i_c_264014,"The life cycle of a flea can last anywhere from 20 days to an entire year. It depends on how long the flea remains in the dormant stage (eggs, larvae, pupa). Outside influences, such as weather, affect the flea cycle. A female flea can lay around 20 to 25 eggs in one day. The life cycle of a flea can last anywhere from 20 days to an entire year. It depends on how long the flea remains in the dormant stage (eggs, larvae, pupa). Outside influences, such as weather, affect the flea cycle. A female flea can lay around 20 to 25 eggs in one day. The flea egg stage is the beginning of the flea cycle. This part of the flea cycle represents a little more than one third of the flea population at any given time. Depending on the temperature and humidity of the environment the egg can take from two to six days to hatch. Stickfast flea life history. The complete life cycle of the flea takes about four weeks, varying according to the temperature. The female fleas lay at night while attached to the bird, and the very small eggs fall to the ground. In about four days, small wormlike larvae emerge from the eggs. The larvae feed on organic material, mainly the dried blood excreted by the adult fleas, and shelter in the surface dust and litter on the soil.",0
1121402,i_c_1121402,"2016-09-28T08:13:26-04:00. Farmers can reduce soil erosion by contour plowing. The correct option among all the options that are given in the question is the second option or option B. The other choices given in the question are incorrect and can be neglected. I hope that this is the answer that has actually come to your desired help. In contour plowing, the land is plowed across the slopes and along the contour lines. This will also reduce soil erosion and make rainwater infiltrate into the soil more than on land plowed along the slope. Terraces are more effective than contour plowing alone in minimizing soil erosion and facilitating infiltration f rainfall into the soil. Contour plowing. Contour ploughing or contour farming is the farming practice of ploughing and/or planting across a slope following its elevation contour lines. These contour lines create a water break which reduces the formation of rills and gullies during times of heavy water run-off; which is a major cause of top soil loss and soil erosion.",0
962179,i_c_962179,"The Salvation Army was founded in London’s East End in 1865 by one-time Methodist minister William Booth and his wife Catherine. Originally, Booth named the organization the East London Christian Mission. The Salvation Army is an integral part of the Christian Church, although distinctive in government and practice. The Army’s doctrine follows the mainstream of Christian belief and its articles of faith emphasise God’s saving purposes. The movement, founded in 1865 by William Booth, has spread from London, England, to many parts of the world. martin so tell us about how the salvation army started prof winston the salvation army was the brainchild of william booth who was a british evangelist and in the 1860s and 70s he tried several different missions to reach the un churched poor in london but none were very successful so one day he was brainstorming with his top command well i call it a command in retrospect but with his top men and they said what we need is an army a salvation army and he loved the name he was sort of autocratic to start with and so they had a great time making this into a living metaphor",0
1117099,i_c_1117099,"Best Answer: An active margin is a tectonic plate boundary, a passive margin is a compositional transition within a tectonic plate. As you probably know the theory of plate tectonics posits the outer layer of the Earth consist of plates which move relative to each other driven by convection in the Mantle. An active plate margin is an actual plate boundary, where oceanic crust and continental crust crash into each other. Active plate margins are often the site of earthquakes and volcanoes. Oceanic crust created by seafloor spreading in the East Pacific Rise, for instance, may become part of the Ring of Fire, the horseshoe-shaped pattern of volcanoes and earthquake zones around the Pacific ocean basin. An active continental margin refers to the submerged edge of a continent overriding an oceanic lithosphere at a convergent plate boundary by opposition with a passive continental margin which is the remaining scar at the edge of a continent following continental break-up.",0
148538,i_c_148538,"Cancel. The difference between an RN and a BSN is that an RN is a title for a registered nurse, while a BSN stands for a Bachelor of Science in nursing. Learn about the differences between degrees and licenses with help from a licensed RN in this free video on nursing jobs and health care. Difference Between Rn and Bsn. RN vs BSN. RN is a Registered Nurse, and is a health care specialist who uses her learned nursing practices and processes to take care of an ailing person. A Registered Nurse is trained and qualified to treat patients. The Associate degree is two years, but on the other hand, the Bachelors degree takes four years. So first of all, you should know RN stands for Registered Nurse. And BSN stands for Bachelors of Science and Nursing. So right off the by, you see there's a difference. The BSN is a degree that you get in a university. It's usually a four year degree. And from there, you can take a state regulated test or the NCLEX.",0
451602,i_c_451602,"Medical Definition of Mechanical ventilation. Mechanical ventilation: Use of a machine called a ventilator or respirator to improve the exchange of air between the lungs and the atmosphere. Last Editorial Review: 5/13/2016. Mechanical ventilation may be defined as the use of a mechanical device to provide. ventilator support for patients. There are 2 types of mechanical ventilation: positive and. negative pressure ventilation. Positive pressure ventilation delivers a positive pressure to. inflate the lungs. Expiration is passive. Nasotracheal intubation In medicine, mechanical ventilation is a method to mechanically assist or replace spontaneous breathing. Mechanical ventilation is typically used after an invasive intubation, a procedure wherein an endotracheal or tracheostomy tube is inserted into the airway.",0
359349,i_c_359349,"The midsegment of a trapezoid is the segment that joins the midpoints of the nonparallel sides of a trapezoid. In the trapezoid below, the midpoints of the non-parallel sides are points S and V. The midsegment is the red line segment from S to V. The midsegment below can be found by. 1  calculating the lengths of the bases. 2  35-16 = 9 (length of upper base). 3  45-0 =45 (length of lower base). 4  calculating the sum of the bases. 5  9+45 = 54. The midsegment of a trapezoid is the segment that joins the midpoints of the nonparallel sides of a trapezoid. In the trapezoid below, the midpoints of the non-parallel sides are points S and V. The midsegment is the red line segment from S to V. The midsegment below can be found by. 1  calculating the lengths of the bases. 2  35-16 = 9 (length of upper base). 3  45-0 =45 (length of lower base). 4  calculating the sum of the bases. According to this theorem mid segment of a trapezoid is equal to half of sum of its two parallel sides. In triangle ABC M is mid point of AB and P is midpoint of AC. so MP is mid segment of triangle ABC. similarly just apply this rule in triangle ACD the PN is midsegment of triangle ACD.",0
1115776,i_c_1115776,"AML Analysts are responsible for detecting and monitoring suspicious transactions in an effort to prevent money laundering. A typical AML Analyst resume usually describes duties such as implementing anti money laundering procedures, assessing daily financial activity, and preparing regular reports to AML Compliance Officers. The BSA / AML Analyst is responsible for monitoring and investigating customer transactions under applicable anti-money laundering and anti-terrorist financing laws. The BSA/AML Analyst II is responsible for assisting with anti-money laundering and compliance initiatives. Three (3) to five (5) years of BSA related experience is required. southeastapply.com",0
1112341,i_c_1112341,"T he following concepts are part of Thai everyday life: ใจเย็น or JAI YEN is more a way of life, it is to keep your temper whatever the situation. T hai people are educated in the family and in school to keep frustration inside. Instead of showing their anger toward a problem or situation, Thai people show JAI YEN, i.e. calm or patience. A n important thing in everyday life is SANUK. Thai people love to have fun together. SANUK can represent many things : eat together, to be with friends and chat, to go out with friends. For Thai people SANUK happens with several persons. When coming back from business, Thai people often ask was it fun ? The following concepts are part of Thai everyday life: ใจเย็น or JAI YEN is more a way of life, it is to keep your temper whatever the situation.",0
131843,i_c_131843,"Definition of SIGMET. plural. SIGMETs. also. sigmets. : a notice of significant hazardous weather conditions (such as extreme turbulence, icing, or poor visibility) in a large area that is provided to the pilot of an aircraft before takeoff — compare airmet. SIGMET, or Significant Meteorological Information, is a weather advisory that contains meteorological information concerning the safety of all aircraft. There are two types of SIGMETs, convective and non-convective. sigmet SIGMET, or Significant Meteorological Information, is a weather advisory that contains meteorological information concerning the safety of all aircraft. There are two types of SIGMETs, convective and non-convective.",0
104861,i_c_104861,"Video on the cost of concrete floors. Depending on the level of complexity, concrete floors can cost as little as $2 to $6 a square foot or be as expensive as $15 to $30 a square foot. Day's Concrete Floors, Inc is the name of my company. We pour a lot of 3000 psi. concrete for interior concrete floors and 4000 psi concrete for exterior concrete. The concrete cost per yard of concrete is $92.00 for 3000 3/4 psi concrete and $100.00 for 4000 3/4 psi concrete. Video on the cost of concrete floors. Depending on the level of complexity, concrete floors can cost as little as $2 to $6 a square foot or be as expensive as $15 to $30 a square foot.epending on the level of complexity, concrete floors can cost as little as $2 to $6 a square foot or be as expensive as $15 to $30 a square foot.",0
833860,i_c_833860,"Italian cuisine is popular in contemporary Switzerland, particularly pasta and pizza. Foods often associated with Switzerland include cheese and chocolate. Swiss cheeses, in particular Emmental cheese, Gruyere, Gruyère, vacherin And, appenzeller are Famous swiss. Products the most popular cheese dishes are fondue And. racletten the Italian-speaking part of Switzerland, the Ticino area, one will find a type of restaurant unique to the region. The Grotto is a rustic eatery, offering traditional food ranging from pasta to homemade meat specialties. Popular dishes are Luganighe and Luganighetta, a type of artisan sausages. 1 Pastetli-This is a popular food in Switzerland. 2  It is a meat pie with different fillings which include meat and mushrooms with cream sauce. 3  Zurcher Geschnetzeltes-This dish is Zurich style cut meat. 4  It is often served with hashed potatoes but could be served with mashed potatoes, pasta or rice.ood of Switzerland. Traditional Food in Switzerland. There are many different dishes in Switzerland that are regional. Italian food is very common in modern Switzerland including pasta and pizza. Swiss cheese includes Emmental cheese, Vacherin and Appenzeller. A cart displaying food produced in Switzerland. There are many regional dishes in Switzerland. One example is Zürcher Geschnetzeltes, thin strips of veal with mushrooms in a cream sauce served with Rösti. Italian cuisine is popular in contemporary Switzerland, particularly pasta and pizza. Foods often associated with Switzerland include cheese and chocolate.",0
207786,i_c_207786,"Sharks' blood gives them turbo speed. Several species of shark and tuna have something special going on inside their bodies. For a long time, scientists have known that some fish species appear warm-blooded. Salmon sharks can elevate their body temperatures by up to 20 degrees compared to the surrounding water, for example. Great white sharks are some of the only warm blooded sharks. This allows them to swim in colder waters in addition to warm, tropical waters. Great White sharks can be found as… north as Alaska and as south as the southern tip of South America. They exist worldwide, everywhere in-between. 5 people found this useful. More on Warm-Bodied Sharks. Shortfin Mako (Isurus oxyrinchus) A question came across SHARK-L concerning makos being considered warm-blooded and various replies touch upon aspects of the topic. I responded to the original query and went onto expand upon or correct some of those responses.",0
