qid,docno,text,rank
443396,m_1465664,"one doing business in any other state. -lp must file an application for registration. -new state issues a certificate of registration, allowing the lp to utilize all assets of that state. -- law of the state in which the lp is formed is the law that governs the ops organization, internal affairs, and liability of its limited partners.",2
1121709,m_3928432,So the answer is 1000 percent.,0
1121709,m_4965913,"60 percent carbohydrates, 30 percent fats, 10 percent proteins.",1
1121709,m_1243379,"These rates are 0 percent for an individual in the 10 or 15 percent marginal tax rate bracket,15 percent for an individual in the 25 percent, 28 percent, 33 percent, or 35 percent tax rate bracket, and 20 percent for those in the top (39.6 percent) tax bracket.",2
87452,m_8819111,"Suicide surpassed war as the military's leading cause of death. War was the leading cause of death in the military nearly every year between 2004 and 2011 until suicides became the top means dying for in 2012 and 2013, according to a bar chart published this week in a.",0
87452,m_8333919,"Suicide surpassed war as the military's leading cause of death. War was the leading cause of death in the military nearly every year between 2004 and 2011 until suicides became the top means dying for in 2012 and 2013, according to a bar chart published this week in a.",1
87452,m_186939,"Combat Fatalities not the Most Common Cause of Military Deaths. Suicide was the third leading cause of Canadian military deaths after motor vehicle accidents and cancerin a newly published study of 25 years of death records. Even though the jury is out on whether suicide prevention programs work, Lt.-Col.",2
855410,m_8651775,"Theraderm Skin Renewal System is described as a total skincare system that may produce younger looking skin. This 5-product system is said to reduce fine lines, take care of rough skin and address sun damage. However, this system has received some low scores on consumer-driven websites that rate anti-aging products, which makes us wonder if this system does not live up to expectations.",0
855410,m_8651776,"In the case of Theraderm, this is taken even further, as the brand was founded by a plastic surgeon, Dr. James Beckman.",1
855410,m_8651772,"Nowadays there are many skin care brands, like Theraderm, which are actively promoted by doctors and dermatologists. This is an interesting approach, because it boosts the image of the products through the associated skin care expertise of a doctor.",2
1114646,m_8117093,"Also, let your healthcare provider know if you are: 1 Pregnant or thinking of becoming pregnant (see Famvir and Pregnancy) 2 Breastfeeding (see Famvir and Breastfeeding).",0
1114646,m_8117087,"Common Questions and Answers about Famvir no prescription famvir My doctor gave me a prescription for famvir, which I was able to start taking approx 30 hours after being infected...already had a significant patch of little white dots. It was the first one had every had (I know because I became very ill with a fever and night sweats etc a couple of days later).",1
1114646,m_771368,"The antiviral medicines available for treatment include acyclovir (Zovirax), famciclovir (Famvir), and valacyclovir (Valtrex).",2
19335,m_8412684,Ecological Anthropology. Ecological anthropology attempts to understand the relative influence of environment on human societies and how it is used by different societies.,0
19335,m_7267248,"Define anthropological. anthropological synonyms, anthropological pronunciation, anthropological translation, English dictionary definition of anthropological. n. 1. The scientific study of the origin, the behavior, and the physical, social, and cultural development of humans. 2. That part of Christian theology...",1
19335,m_8412687,"The Journal of Ecological Anthropology (JEA), ISSN 1528-6509, is a double-blind peer-reviewed interdisciplinary forum for innovative exploration of the interface between humans and their sociocultural and biophysical environments.",2
47923,m_5032362,Synaptic knobs are located at the tip of each axon terminal.,0
47923,m_8641107,Axons usually have thousands of terminal branches that each end as a bulbous enlargement called a synaptic knob or synaptic terminal. Synaptic knobs contain several membrane-bounded synaptic vesicles that are 40 to 100 nanometers in diameter.,1
47923,m_1868437,"The dendrites don’t have terminating knobs at the end of it. The axon is not an axon because it’s long, it’s an axon because of the existence of synaptic knobs at the axon terminals. When the axon conducts action potentials away from the cell body and the signal goes to the synaptic knob, it’s going to release a neurotransmitter in response to the electrical signal.",2
405717,m_6654655,"CDG PARIS AIRPORT SHUTTLE. Do not lose your time on your arrival to CDG Paris. Airport-Shuttle offers automobiles with drivers specialized in the door-to-door transport of passengers between Paris airports (CDG, ORY and BVA) and Paris hotels.",0
405717,m_7447941,"cdg, Paris Charles de Gaulle Airport, Paris, France weather text for Thu 20th April. The cdg, Paris Charles de Gaulle Airport, Paris, France weather is going to be sunny. cdg, Paris Charles de Gaulle Airport, Paris, France visibility is going to be around 20 km i.e. 12 miles and an atmospheric pressure of 1035 mb.",1
405717,m_8433858,Charles de Gaulle Airport (CDG) to Paris by Train. This is an overview of how to travel from Charles de Gaulle-CDG Airport to Central Paris by city train (RER B). For instructions in the opposite direction see Paris to Airport CDG by Train. For step-by-step photo instructions see Terminal 2 to Paris by train or Terminal 1 to Paris by train.,2
182539,m_57444,"To solidify our understanding of what a monotonic function is, let's consider what a non-monotonic function is. For example, consider our initial example f(x) equals x 2.",0
182539,m_57443,Monotonic Function. Monotonic functions are the functions which maintained the order of functions value. As we all know that the variation in independent value also make the variation in functions value. A suitable example for this is monotonic functions or linear polynomials. The monotonic functions maintains the straight line in linear programming graph. This is also called the monotonic nature over the domain and real numbers. A monotonic function increases and decreases over the interval.,1
182539,m_57447,"Montonic Function. For example, consider the function g(x) equals x 3: Notice the graph of g is increasing everywhere. Therefore, this is a monotonic function.",2
1113437,m_8128798,"Description Spruce trees are large, with some species maturing up to 200 feet tall.",0
1113437,m_8128790,"Description . Spruce trees are large, with some species maturing up to 200 feet tall. They have a strongly conical shape, especially when they are young.",1
1113437,m_6021898,"Product Description. Baby Blue Eyes Spruce is a conical-shaped, fully branched selection of Colorado Spruce with a uniform growth habit and intense blue needles. On the average it will grow upward about 8 inches per year compared to some Colorado Spruce that can grow as much as 12 to 18 inches upward per year. *Nickname.",2
1129237,m_128984,"Hydrogen gas has the molecular formula H 2. At room temperature and under standard pressure conditions, hydrogen is a gas that is tasteless, odorless and colorless. Hydrogen can exist as a liquid under high pressure and an extremely low temperature of 20.28 kelvin (−252.87°C, −423.17 °F). Hydrogen is often stored in this way as liquid hydrogen takes up less space than hydrogen in its normal gas form. Liquid hydrogen is also used as a rocket fuel.",0
1129237,m_2697752,"Hydrogen condenses into a liquid or freezes solid at extremely cold... Hydrogen condenses into a liquid or freezes solid at extremely cold temperatures. Hydrogen's state of matter can change when the temperature changes, becoming a liquid at temperatures between minus 423.18 and minus 434.49 degrees Fahrenheit. It becomes a solid at temperatures below minus 434.49 F.Due to its high flammability, hydrogen gas is commonly used in combustion reactions, such as in rocket and automobile fuels.",1
1129237,m_7911557,What is the temperature of the gas turn to liquid? Every gas has a different liquidation temperature based on what element it is. Hydrogen has a liquidation point of 423.17 degrees below zero F.,2
146187,m_8434623,"There is a discernible difference between the two burgers, especially in the meat quality. The McDouble contains gristle and carry's a different flavor than the Double Cheeseburger. The double cheeseburger tastes more like beef. The McDouble tastes of whatever meat filler they use to fill the gap.",0
146187,m_8434626,"But I did it for you. With McDonald's recent release of the McDouble, they now have three basic, sub-$2 cheeseburgers: the cheeseburger, McDouble (two patties with one slice of cheese), and double cheeseburger (two patties with two slices of cheese).",1
146187,m_8434622,"Although we previously reported that the McDouble would be on the Dollar Menu, in Manhattan the cheeseburger appears on the Dollar Menu while the McDouble is $1.39 and the double cheeseburger is $1.49.",2
